subject,deck,topic,front,back
Ophthalmology,Part-6 Lens & Cataract,Cataract Surgery,List the acute post-operative complications of cataract surgery.,"Iris prolapse, endophthalmitis, TASS, shallow AC."
Ophthalmology,Part-6 Lens & Cataract,Cataract Surgery,What does TASS stand for?,Toxic Anterior Segment Syndrome.
Ophthalmology,Part-6 Lens & Cataract,Cataract Surgery,List the chronic complications of cataract surgery.,"PCO, Irvine-Gass syndrome, IOL displacement, endophthalmitis."
Ophthalmology,Part-6 Lens & Cataract,Cataract Surgery,"What is the most common chronic complication of cataract surgery, its associated finding, and treatment?",PCO (posterior capsular opacification); forms a Sommering ring; treated with Nd:YAG laser 1064 nm.
Ophthalmology,Part-6 Lens & Cataract,Cataract Surgery,"What is Irvine-Gass syndrome, and its timing?","Delayed cystoid macular edema, about 6-10 weeks post-op."
Ophthalmology,Part-6 Lens & Cataract,Cataract Surgery,Most common causes of early vs late onset post-op endophthalmitis?,Early onset: coagulase-negative staphylococci (CONS); late onset: P. acnes.
Ophthalmology,Part-6 Lens & Cataract,Cataract Surgery,Elschnig pearls are a finding in which post-cataract complication?,Posterior capsular opacification (PCO).
Ophthalmology,Part-7 Surgical Instruments,Topical Anesthetic,"Which topical anesthetic is shown, its concentration, and half-life?",Proparacaine hydrochloride 0.5%; half-life 15-20 minutes.
Ophthalmology,Part-7 Surgical Instruments,Instruments,What is the superior rectus holding forceps used for?,To place a bridle suture.
Ophthalmology,Part-7 Surgical Instruments,Instruments,What is a cystitome used for?,Continuous curvilinear capsulorrhexis (CCC).
Ophthalmology,Part-7 Surgical Instruments,Instruments,What does trypan blue stain?,The anterior lens capsule.
Ophthalmology,Part-7 Surgical Instruments,Instruments,Which instrument is used for hydrodissection / lens delivery?,Wire vectis.
Ophthalmology,Part-7 Surgical Instruments,Instruments,What is Simcoe's cannula used for?,Irrigation and aspiration (suction of cortex).
Ophthalmology,Part-7 Surgical Instruments,Instruments,What material is a rigid IOL made of?,PMMA.
Ophthalmology,Part-7 Surgical Instruments,Instruments,What is the best IOL material?,Hydrophobic acrylic.
Ophthalmology,Part-7 Surgical Instruments,Instruments,Name the IOL power calculation formulas.,"Holladay, Hoffer Q, SRK-T."
Ophthalmology,Part-7 Surgical Instruments,Instruments,Which IOL formula is used for myopic (post-LASER) eyes?,Haigis-L.
Ophthalmology,Part-7 Surgical Instruments,Hordeolum,What is an external hordeolum?,Inflammation of the Zeis gland of the eyelid.
Ophthalmology,Part-7 Surgical Instruments,Hordeolum,What is an internal hordeolum?,Acute inflammation of the meibomian gland.
Ophthalmology,Part-7 Surgical Instruments,Chalazion,What is a chalazion?,Chronic granulomatous inflammation of the meibomian gland.
Ophthalmology,Part-7 Surgical Instruments,Instruments,What is left behind in evisceration (and which scoop is used)?,The sclera is left behind (evisceration scoop).
Ophthalmology,Part-7 Surgical Instruments,Instruments,What is Kerison's bone punch used for?,DCR (dacryocystorhinostomy).
Ophthalmology,"Part-8 Lacrimal, Trauma & Orbit",Lacrimal Apparatus,"Where does the nasolacrimal duct open, and in which direction does it run?",Opens into the inferior meatus; runs inferolaterally and posteriorly.
Ophthalmology,"Part-8 Lacrimal, Trauma & Orbit",Tear Film,What are the three layers of the tear film and their sources?,"Inner mucin layer (goblet cells), middle aqueous layer (lacrimal gland), outer lipid layer (meibomian gland)."
Ophthalmology,"Part-8 Lacrimal, Trauma & Orbit",Tear Film,Deficiency of which tear layer is caused by vitamin A deficiency?,Inner mucin (goblet cell) layer.
Ophthalmology,"Part-8 Lacrimal, Trauma & Orbit",Tear Film,Deficiency of the aqueous layer is seen in which condition?,Keratoconjunctivitis sicca (lacrimal involvement).
Ophthalmology,"Part-8 Lacrimal, Trauma & Orbit",Tear Film,The outer lipid layer is deficient in whom?,Contact lens users.
Ophthalmology,"Part-8 Lacrimal, Trauma & Orbit",Watering Eye,"On syringing/probing, what does a hard stop indicate vs a soft stop?",Hard stop = NLD obstruction; soft stop = canaliculi/lacrimal sac obstruction.
Ophthalmology,"Part-8 Lacrimal, Trauma & Orbit",Watering Eye,"If there is no obstruction on syringing, what test is done next?",Jones dye test 1.
Ophthalmology,"Part-8 Lacrimal, Trauma & Orbit",Watering Eye,A positive (opacify+) Jones dye test 1 indicates what?,Hypersecretion of tears.
Ophthalmology,"Part-8 Lacrimal, Trauma & Orbit",Watering Eye,"If Jones dye test 1 is negative, what is done, and how is test 2 interpreted?",Jones dye test 2: opacify+ = partial obstruction; opacify- = pump failure.
Ophthalmology,"Part-8 Lacrimal, Trauma & Orbit",Lacrimal Tests,What is the Schirmer's test filter and the normal value?,Whatman filter no. 41; normal >15 mm over ~5 minutes.
Ophthalmology,"Part-8 Lacrimal, Trauma & Orbit",Lacrimal Tests,How long does the phenol red test take?,~15 seconds.
Ophthalmology,"Part-8 Lacrimal, Trauma & Orbit",Lacrimal Tests,"What does tear breakup time assess, and the normal value?",Mucin (tear film stability); normal >10 seconds.
Ophthalmology,"Part-8 Lacrimal, Trauma & Orbit",Congenital Dacryocystitis,What is the most common cause of congenital dacryocystitis?,Obstruction at the valve of Hasner (NLD).
Ophthalmology,"Part-8 Lacrimal, Trauma & Orbit",Congenital Dacryocystitis,What is the stepwise management of congenital dacryocystitis?,Massage + topical antibiotics -> syringing & probing -> DCR (into the middle meatus) after 4 years.
Ophthalmology,"Part-8 Lacrimal, Trauma & Orbit",Iron Lines,Which corneal iron line is associated with siderosis bulbi?,Hudson-Stahli line.
Ophthalmology,"Part-8 Lacrimal, Trauma & Orbit",Iron Lines,What is Stocker's line?,Iron deposition around a pterygium.
Ophthalmology,"Part-8 Lacrimal, Trauma & Orbit",Iron Lines,What is Ferry's line?,Iron deposition around a filtering bleb.
Ophthalmology,"Part-8 Lacrimal, Trauma & Orbit",Iron Lines,What is the Fleischer ring (iron deposition)?,Iron deposition in the corneal epithelium (keratoconus).
Ophthalmology,"Part-8 Lacrimal, Trauma & Orbit",Trauma,A Vossius ring is a sign of what?,Blunt ocular trauma.
Ophthalmology,"Part-8 Lacrimal, Trauma & Orbit",Trauma,Iridodialysis vs iridodonesis - what does iridodonesis produce?,A tremulous iris.
Ophthalmology,"Part-8 Lacrimal, Trauma & Orbit",Trauma,What type of cataract is associated with trauma?,Rosette / stellate cataract.
Ophthalmology,"Part-8 Lacrimal, Trauma & Orbit",Trauma,"What is siderosis bulbi, and its IOC and contraindication?",Iron-containing intraocular foreign body; IOC is NCCT; MRI is contraindicated.
Ophthalmology,"Part-8 Lacrimal, Trauma & Orbit",Trauma,Which organs have immune privilege (relevant to sympathetic ophthalmia)?,The eye and the testes.
Ophthalmology,"Part-8 Lacrimal, Trauma & Orbit",Sympathetic Ophthalmia,Penetrating trauma to which structure (and after what time) leads to sympathetic ophthalmia?,The ciliary body; after more than 2 weeks.
Ophthalmology,"Part-8 Lacrimal, Trauma & Orbit",Sympathetic Ophthalmia,What is the nature of sympathetic ophthalmia and its characteristic nodules?,Bilateral (contralateral) granulomatous panuveitis; Dalen-Fuchs nodules.
Ophthalmology,"Part-8 Lacrimal, Trauma & Orbit",Sympathetic Ophthalmia,How is sympathetic ophthalmia prevented and treated?,Prevention: enucleation; treatment: steroids.
Ophthalmology,"Part-8 Lacrimal, Trauma & Orbit",Eye Removal Surgery,"What does enucleation involve, and its indications?","Removal of the globe with the optic nerve; indicated in retinoblastoma, sympathetic ophthalmitis, trauma."
Ophthalmology,"Part-8 Lacrimal, Trauma & Orbit",Eye Removal Surgery,"What does evisceration involve, and its indication?",Sclera is left behind; indicated in endophthalmitis.
Ophthalmology,"Part-8 Lacrimal, Trauma & Orbit",Eye Removal Surgery,"What does exenteration involve, and its indications?",Removal of all eyeball/orbital contents; indicated in mucormycosis and metastasis.
Ophthalmology,"Part-8 Lacrimal, Trauma & Orbit",Proptosis,How is proptosis defined by measurement?,When the distance between the lateral orbital margin and the cornea exceeds 21 mm.
Ophthalmology,"Part-8 Lacrimal, Trauma & Orbit",Proptosis,Which instrument measures proptosis?,Hertel's exophthalmometer.
Ophthalmology,"Part-8 Lacrimal, Trauma & Orbit",Proptosis,What causes pulsatile proptosis?,Caroticocavernous fistula (CCF).
Ophthalmology,"Part-8 Lacrimal, Trauma & Orbit",Proptosis,Proptosis that increases on bending/Valsalva suggests what?,Orbital varix.
Ophthalmology,"Part-8 Lacrimal, Trauma & Orbit",Proptosis,Proptosis that increases on crying suggests what?,Encephalocele or hemangioma.
Ophthalmology,"Part-8 Lacrimal, Trauma & Orbit",Proptosis,Proptosis that increases with URTI suggests what?,Lymphangioma.
Ophthalmology,"Part-8 Lacrimal, Trauma & Orbit",Orbital Apex vs CST,Which nerves are involved in orbital apex syndrome vs cavernous sinus thrombosis?,"Orbital apex: II, III, IV, VI, V1; CST: VI first, then III, IV, V1, V2."
Ophthalmology,"Part-8 Lacrimal, Trauma & Orbit",Orbital Apex vs CST,Is ophthalmoplegia present in orbital apex syndrome and CST?,Yes - present in both.
Ophthalmology,"Part-8 Lacrimal, Trauma & Orbit",Orbital Apex vs CST,Is vision loss present in orbital apex syndrome vs CST?,Orbital apex: yes; CST: no.
Ophthalmology,"Part-8 Lacrimal, Trauma & Orbit",Orbital Apex vs CST,Is the presentation unilateral or bilateral - orbital apex vs CST?,Orbital apex: unilateral; CST: bilateral.
Ophthalmology,"Part-8 Lacrimal, Trauma & Orbit",Orbital Apex vs CST,Compare chemosis/proptosis and onset - orbital apex vs CST.,"Orbital apex: increased, gradual onset; CST: markedly increased, sudden onset."
Ophthalmology,"Part-8 Lacrimal, Trauma & Orbit",Orbital Apex,What is Tolosa-Hunt syndrome localized to?,The orbital apex.
Ophthalmology,"Part-8 Lacrimal, Trauma & Orbit",CCF,A dilated superior ophthalmic vein on imaging suggests what?,Caroticocavernous fistula (CCF).
Ophthalmology,"Part-8 Lacrimal, Trauma & Orbit",Orbital Metastasis,Most common cause of orbital metastasis in a child vs adult?,Child: neuroblastoma; adult: breast carcinoma.
Ophthalmology,"Part-8 Lacrimal, Trauma & Orbit",Orbital Tumors,Most common primary orbital tumor in a child - benign vs malignant?,Benign: dermoid; malignant: rhabdomyosarcoma.
Ophthalmology,"Part-8 Lacrimal, Trauma & Orbit",Orbital Tumors,Most common orbital tumor in an adult - benign vs malignant?,Benign: hemangioma; malignant: non-Hodgkin lymphoma (NHL).
Ophthalmology,Part-9 Strabismus & Ocular Motility,EOM Actions,Nerve supply and action of the medial rectus (MR)?,CN III; action: adduction only.
Ophthalmology,Part-9 Strabismus & Ocular Motility,EOM Actions,Nerve supply and action of the lateral rectus (LR)?,CN VI; action: abduction only.
Ophthalmology,Part-9 Strabismus & Ocular Motility,EOM Actions,Nerve supply and actions of the superior rectus (SR)?,"CN III; primary elevation, secondary intorsion, tertiary adduction."
Ophthalmology,Part-9 Strabismus & Ocular Motility,EOM Actions,Nerve supply and actions of the inferior rectus (IR)?,"CN III; primary depression, secondary extorsion, tertiary adduction."
Ophthalmology,Part-9 Strabismus & Ocular Motility,EOM Actions,Nerve supply and actions of the superior oblique (SO)?,"CN IV; primary intorsion, secondary depression, tertiary abduction."
Ophthalmology,Part-9 Strabismus & Ocular Motility,EOM Actions,Nerve supply and actions of the inferior oblique (IO)?,"CN III; primary extorsion, secondary elevation, tertiary abduction."
Ophthalmology,Part-9 Strabismus & Ocular Motility,EOM Actions,What do the mnemonics SIN and RAD mean for EOM?,SIN = Superior muscles Intort; RAD = Rectus muscles Adduct.
Ophthalmology,Part-9 Strabismus & Ocular Motility,EOM Actions,Which extraocular muscles are supplied by CN III?,"Medial rectus, superior rectus, inferior rectus, inferior oblique."
Ophthalmology,Part-9 Strabismus & Ocular Motility,EOM Actions,"Which muscle is supplied by CN IV, and which by CN VI?",CN IV - superior oblique; CN VI - lateral rectus.
Ophthalmology,Part-9 Strabismus & Ocular Motility,Squint Laws,State Hering's law.,Yoke muscles must receive equal innervation at the same time.
Ophthalmology,Part-9 Strabismus & Ocular Motility,Squint Laws,State Sherrington's law.,Reciprocal inhibitory innervation is sent to the antagonist muscle.
Ophthalmology,Part-9 Strabismus & Ocular Motility,Squint Terminology,"Define eso-, exo-, hyper-, and hypo-deviation.",Eso = inward; exo = outward; hyper = upward; hypo = downward.
Ophthalmology,Part-9 Strabismus & Ocular Motility,Squint Terminology,Which refractive error is associated with esodeviation?,Hypermetropia.
Ophthalmology,Part-9 Strabismus & Ocular Motility,Squint Terminology,Difference between phoria and tropia?,Phoria = latent squint; tropia = manifest squint.
Ophthalmology,Part-9 Strabismus & Ocular Motility,Squint Types,What does 'second deviation greater than first' indicate?,Paralytic squint.
Ophthalmology,Part-9 Strabismus & Ocular Motility,Squint Types,What does 'first deviation equal to second deviation' indicate?,Non-paralytic (concomitant) squint.
Ophthalmology,Part-9 Strabismus & Ocular Motility,Squint Tests,What does the Hess chart assess?,Diplopia (in paralytic squint).
Ophthalmology,Part-9 Strabismus & Ocular Motility,Ptosis Localization,Ptosis with a dilated pupil suggests what?,Third (oculomotor) nerve palsy.
Ophthalmology,Part-9 Strabismus & Ocular Motility,Ptosis Localization,Ptosis with a constricted pupil suggests what?,Horner's syndrome.
Ophthalmology,Part-9 Strabismus & Ocular Motility,Ptosis Localization,Ptosis with a normal light reflex suggests what?,Myasthenia gravis.
Ophthalmology,Part-9 Strabismus & Ocular Motility,Third Nerve Palsy,What is the classic eye position in third nerve palsy?,'Down and out' with ptosis and a dilated pupil.
Ophthalmology,Part-9 Strabismus & Ocular Motility,Park 3-Step Test,What does the mnemonic 'IGI' mean?,"If squint Increases on Ipsilateral Gaze, the involved muscle is the Inferior (vertical rectus)."
Ophthalmology,Part-9 Strabismus & Ocular Motility,Park 3-Step Test,What does the mnemonic 'ITO' mean?,"If squint Increases on Ipsilateral Tilt, the involved muscle is an Oblique."
Ophthalmology,Part-9 Strabismus & Ocular Motility,Park 3-Step Test,A left hypertropia increasing on right gaze and right tilt localizes to which muscle?,Right superior rectus.
Ophthalmology,Part-9 Strabismus & Ocular Motility,Park 3-Step Test,A right hypotropia (= left hypertropia) increasing on left tilt and right gaze localizes to which muscle?,Left superior oblique.
Ophthalmology,Part-9 Strabismus & Ocular Motility,Squint Tests,What does the cover test detect?,Manifest squint (tropia) - the uncovered eye moves to take up fixation.
Ophthalmology,Part-9 Strabismus & Ocular Motility,Squint Tests,What does the uncover (cover-uncover) test detect?,Latent squint (phoria) - the covered eye drifts and corrects on uncovering.
Ophthalmology,Part-9 Strabismus & Ocular Motility,Squint Tests,What does the Maddox rod test assess?,The type and degree of deviation (eso/exo/hyper/hypo).
Ophthalmology,Part-9 Strabismus & Ocular Motility,Squint Tests,What does the Worth 4-dot test assess?,Fusion vs suppression vs diplopia (binocular single vision).
Ophthalmology,Part-9 Strabismus & Ocular Motility,Squint Tests,What does the prism bar test measure?,The angle of deviation.
Ophthalmology,Part-10 Refraction,Myopia,"In myopia, what are the axial length, AC depth, and squint type?",Axial length increased; anterior chamber deeper; exodeviation.
Ophthalmology,Part-10 Refraction,Hypermetropia,"In hypermetropia, what are the axial length, AC depth, and squint type?",Axial length decreased; anterior chamber shallow; esodeviation.
Ophthalmology,Part-10 Refraction,Myopia Types,What is axial myopia?,Myopia due to increased axial length.
Ophthalmology,Part-10 Refraction,Myopia Types,What causes curvature myopia?,Keratoconus.
Ophthalmology,Part-10 Refraction,Myopia Types,What causes index myopia?,Nuclear cataract.
Ophthalmology,Part-10 Refraction,Myopia Types,What causes positional myopia?,Weil-Marchesani syndrome.
Ophthalmology,Part-10 Refraction,Anisometropia,How is anisometropia defined?,A difference of more than 2.5 D between the two eyes.
Ophthalmology,Part-10 Refraction,High Myopia,List the fundus features of high myopia.,"Tigroid appearance, chorioretinal atrophy, Foster-Fuchs spots, lacquer cracks, rhegmatogenous RD, posterior staphyloma."
Ophthalmology,Part-10 Refraction,Hypermetropia,List the fundus features of hypermetropia.,"Small disc with ill-defined margin (pseudopapillitis), shot-silk (shiny) retina, accentuated vessel reflexes."
Ophthalmology,Part-10 Refraction,Refractive Surgery,"What does LASIK stand for, and how does it work?",Laser Assisted In Situ Keratomileusis; it flattens the cornea.
Ophthalmology,Part-10 Refraction,Refractive Surgery,What are the contraindications to LASIK?,"Age under 18, unstable refractive power, corneal thickness < 450 um."
Ophthalmology,Part-10 Refraction,Visual Acuity,"What is the best possible visual acuity, and the minimum (per notes)?",Best VA 6/5; minimum VA 1/60.
Ophthalmology,Part-10 Refraction,Snellen Chart,The distance from the chart corresponds to what optical point?,The nodal point.
Ophthalmology,Part-10 Refraction,Snellen Chart,What angle does each Snellen letter subtend at its respective distance?,5 minutes of arc.
Ophthalmology,Part-10 Refraction,Snellen Chart,Formula for the angle subtended by the topmost letter viewed from 6 m?,(Distance of letter / distance at which testing) x 5.
Ophthalmology,Part-10 Refraction,Astigmatism,What is astigmatism?,Different refractive power in different axes/meridians.
Ophthalmology,Part-10 Refraction,Astigmatism,"In 'with the rule' (WTR) astigmatism, which axis is more curved, and in whom is it typical?",The vertical axis is more curved; typical in the young.
Ophthalmology,Part-10 Refraction,Astigmatism,"In 'against the rule' (ATR) astigmatism, which axis is more curved, and in whom is it typical?",The horizontal axis is more curved; typical in the old.
Ophthalmology,Part-10 Refraction,Astigmatism,"In WTR astigmatism, what is the correction at the 180 vs 90 meridian?",At 180: concave (minus); at 90: convex (plus).
Ophthalmology,Part-10 Refraction,Astigmatism,"In ATR astigmatism, what is the correction at the 180 vs 90 meridian?",At 180: convex (plus); at 90: concave (minus).
Ophthalmology,Part-10 Refraction,Astigmatism Types,What is simple myopic astigmatism (lens)?,"Only cylinder, e.g., -2 DC."
Ophthalmology,Part-10 Refraction,Astigmatism Types,What is compound myopic astigmatism (lens)?,"Cylinder + sphere, both minus, e.g., -2 DC / -1 DS."
Ophthalmology,Part-10 Refraction,Astigmatism Types,What is mixed astigmatism (lens)?,"One plus and one minus, e.g., +3 DS / -4 DC."
Ophthalmology,Part-10 Refraction,Astigmatism Types,What is simple hyperopic astigmatism (lens)?,"Only cylinder, plus, e.g., +2 DC."
Ophthalmology,Part-10 Refraction,Astigmatism Types,What is compound hyperopic astigmatism (lens)?,"Cylinder + sphere, both plus, e.g., +2 DC / +1 DS."
Ophthalmology,Part-10 Refraction,Astigmatism,What does Sturm's conoid measure?,Astigmatism.
Ophthalmology,Part-10 Refraction,Astigmatism Examples,Classify -2 cyl @ 180.,"Simple myopic, with-the-rule (WTR)."
Ophthalmology,Part-10 Refraction,Astigmatism Examples,Classify -1 DS / -2 DC @ 180.,"Compound myopic, with-the-rule (WTR)."
Ophthalmology,Part-10 Refraction,Astigmatism Examples,Classify -3 sph / -4 D cylindrical @ 90.,"Compound myopic, against-the-rule (ATR)."
Ophthalmology,Part-11 Community Ophthalmology & Miscellaneous,NPCB,How is blindness defined (NPCB)?,"Visual acuity <3/60 or visual field <10 degrees, in the better eye with best possible correction."
Ophthalmology,Part-11 Community Ophthalmology & Miscellaneous,NPCB,How is visual impairment defined?,Visual acuity <6/18 in the better eye with best possible correction.
Ophthalmology,Part-11 Community Ophthalmology & Miscellaneous,Blindness Grades,What VA range is 'low vision' (L)?,<6/18 to 6/60.
Ophthalmology,Part-11 Community Ophthalmology & Miscellaneous,Blindness Grades,"What defines economic blindness (E), and what is lost?",<6/60 to 3/60 (6/120); work vision absent.
Ophthalmology,Part-11 Community Ophthalmology & Miscellaneous,Blindness Grades,"What defines social blindness (S), and what is lost?",<3/60 to 1/60; walk vision absent.
Ophthalmology,Part-11 Community Ophthalmology & Miscellaneous,Blindness Grades,What defines manifest blindness (M)?,<1/60 to perception of light (LP).
Ophthalmology,Part-11 Community Ophthalmology & Miscellaneous,Blindness Grades,What defines absolute blindness (A)?,No perception of light (NLP).
Ophthalmology,Part-11 Community Ophthalmology & Miscellaneous,Blindness Grades,What VA is considered normal?,6/18 or better.
Ophthalmology,Part-11 Community Ophthalmology & Miscellaneous,School Eye Screening,Who performs school eye screening?,The teacher.
Ophthalmology,Part-11 Community Ophthalmology & Miscellaneous,School Eye Screening,What age/grade group and ratio are used in school eye screening?,5th-8th standard (10-14 years); ratio 1:150.
Ophthalmology,Part-11 Community Ophthalmology & Miscellaneous,School Eye Screening,"At what VA is a child referred, and to where?",VA worse than 6/9 -> referred to the PHC.
Ophthalmology,Part-11 Community Ophthalmology & Miscellaneous,Lenticonus,Anterior lenticonus is associated with which syndrome?,Alport syndrome.
Ophthalmology,Part-11 Community Ophthalmology & Miscellaneous,Lenticonus,Posterior lenticonus is associated with which syndrome?,Lowe syndrome (oculo-cerebro-renal syndrome).
Ophthalmology,Part-11 Community Ophthalmology & Miscellaneous,Ectopia Lentis,Superotemporal lens dislocation suggests which condition?,Marfan's syndrome.
Ophthalmology,Part-11 Community Ophthalmology & Miscellaneous,Ectopia Lentis,Inferonasal lens dislocation suggests which condition?,Homocystinuria.
Ophthalmology,Part-11 Community Ophthalmology & Miscellaneous,Ectopia Lentis,Microspherophakia is associated with which syndrome?,Weil-Marchesani syndrome.
Ophthalmology,Part-11 Community Ophthalmology & Miscellaneous,Congenital Glaucoma,What are the features of congenital buphthalmos?,"Blepharospasm, lacrimation, photophobia, Haab's striae, corneal diameter >13 mm."
Ophthalmology,Part-11 Community Ophthalmology & Miscellaneous,Congenital Glaucoma,"What striae are seen in buphthalmos, and their orientation?",Haab's striae; horizontal.
Ophthalmology,Part-11 Community Ophthalmology & Miscellaneous,Congenital Glaucoma,What is the treatment of congenital buphthalmos?,Goniotomy.
Ophthalmology,Part-11 Community Ophthalmology & Miscellaneous,Congenital Glaucoma,At what corneal diameter is buphthalmos suspected?,Corneal diameter greater than 13 mm.
Ophthalmology,Part-11 Community Ophthalmology & Miscellaneous,Eyelid,What does an eyelid coloboma lead to?,Exposure keratitis.
Ophthalmology,Part-11 Community Ophthalmology & Miscellaneous,Eyelid,What is distichiasis?,Two rows of eyelashes.
Ophthalmology,Part-11 Community Ophthalmology & Miscellaneous,Chalazion,What must be ruled out in a recurrent chalazion?,Sebaceous cell carcinoma.
Ophthalmology,Part-11 Community Ophthalmology & Miscellaneous,Eye Medications,Correct order of instillation: eye drops or ointment first?,"Eye drops first, then ointment."
Ophthalmology,Part-11 Community Ophthalmology & Miscellaneous,Steroid Side Effects,Topical steroids classically cause which ocular complication?,Glaucoma.
Ophthalmology,Part-11 Community Ophthalmology & Miscellaneous,Steroid Side Effects,Systemic steroids classically cause which ocular complication?,Cataract.
Ophthalmology,Part-11 Community Ophthalmology & Miscellaneous,Congenital Ptosis,How is congenital ptosis with poor LPS function treated?,Frontalis sling procedure.
Ophthalmology,Part-11 Community Ophthalmology & Miscellaneous,Congenital Ptosis,How is congenital ptosis with good LPS function treated?,LPS (levator) resection.
Ophthalmology,Part-11 Community Ophthalmology & Miscellaneous,Symptom Localization,Gradual progressive painless loss of vision suggests what?,Cataract or open-angle glaucoma.
Ophthalmology,Part-11 Community Ophthalmology & Miscellaneous,Symptom Localization,Sudden painful red eye with loss of vision suggests what?,Angle closure glaucoma or uveitis.
Ophthalmology,Part-11 Community Ophthalmology & Miscellaneous,Symptom Localization,Sudden painless loss of vision suggests what?,Optic neuritis or a posterior retinal cause (CRAO).
Ophthalmology,Part-11 Community Ophthalmology & Miscellaneous,Symptom Localization,Floaters localize to which structure?,The vitreous.
Ophthalmology,Part-11 Community Ophthalmology & Miscellaneous,Symptom Localization,Metamorphopsia localizes to which structure?,The macula.
Ophthalmology,Part-11 Community Ophthalmology & Miscellaneous,Morning Glory Syndrome,What are the features of morning glory syndrome?,Absent lamina cribrosa and retrodisplacement of the optic nerve.
Ophthalmology,Part-11 Community Ophthalmology & Miscellaneous,Color/Stereo Tests,What does the Titmus fly test assess?,Stereopsis.
Ophthalmology,Part-11 Community Ophthalmology & Miscellaneous,Color/Stereo Tests,Which charts test colour vision?,Ishihara chart and the Farnsworth-Munsell 100-hue test.
Ophthalmology,Part-11 Community Ophthalmology & Miscellaneous,Eyelid Fusion,What is symblepharon?,Fusion of the bulbar and palpebral conjunctiva.
