subject,deck,topic,front,back
Ophthalmology,Part-11 Community Ophthalmology & Miscellaneous,Eyelid Fusion,What is ankyloblepharon?,Fusion of the superior and inferior eyelids.
Ophthalmology,Part-11 Community Ophthalmology & Miscellaneous,Lasers,"Which lasers are used for photocoagulation, at what wavelength, and uses?",Frequency-doubled Nd:YAG (532 nm) and argon laser; used for panretinal photocoagulation and laser trabeculoplasty.
Ophthalmology,Part-11 Community Ophthalmology & Miscellaneous,Lasers,"Which laser is used for photoablation, at what wavelength, and use?",Argon fluoride excimer laser (193 nm); used for LASIK.
Ophthalmology,Part-11 Community Ophthalmology & Miscellaneous,Lasers,"Which laser is used for photodisruption, at what wavelength, and uses?",Nd:YAG (1064 nm); used for peripheral iridotomy and treating posterior capsular opacification.
Ophthalmology,Part-11 Community Ophthalmology & Miscellaneous,Lasers,What is the Nd:Glass laser (1053 nm) used for?,FLACS (femtosecond laser-assisted cataract surgery).
Ophthalmology,Part-1 Cornea & Sclera,Corneal Dystrophy,Which corneal dystrophy shows amyloid deposition?,Lattice stromal dystrophy.
Ophthalmology,Part-1 Cornea & Sclera,Corneal Dystrophy,Which corneal dystrophy shows hyaline deposition / bread-crumb appearance?,Granular dystrophy.
Ophthalmology,Part-1 Cornea & Sclera,Corneal Dystrophy,Which corneal dystrophy shows fingerprint defects?,Cogan's epithelial dystrophy.
Ophthalmology,Part-1 Cornea & Sclera,Corneal Opacities,Which corneal opacity is the faintest / least dense?,Nebula.
Ophthalmology,Part-1 Cornea & Sclera,Corneal Investigations,What does bullous keratopathy ultimately lead to?,Opacification of the cornea.
Ophthalmology,Part-1 Cornea & Sclera,Corneal Infections,Wesley's ring is associated with which type of keratitis?,Fungal keratitis.
Ophthalmology,Part-1 Cornea & Sclera,Viral Keratitis,A dendritic ulcer is characteristic of which infection?,Herpes simplex (HSV) keratitis.
Ophthalmology,Part-1 Cornea & Sclera,Scleritis vs Episcleritis,Which condition blanches with 2.5% phenylephrine - scleritis or episcleritis?,Episcleritis.
Ophthalmology,Part-1 Cornea & Sclera,Scleritis vs Episcleritis,Which condition does NOT blanch with 2.5% phenylephrine?,Scleritis.
Ophthalmology,Part-1 Cornea & Sclera,Keratoplasty,Which keratoplasty replaces all corneal layers?,Penetrating keratoplasty (PK).
Ophthalmology,Part-1 Cornea & Sclera,Keratoplasty,Which keratoplasty preserves (does not disturb) the stroma?,DSEK.
Ophthalmology,Part-1 Cornea & Sclera,Keratoplasty,Which keratoplasty replaces cornea only up to the mid-stroma?,DALK.
Ophthalmology,Part-1 Cornea & Sclera,Corneal Anatomy,Which corneal layer has the Na+-K+-ATPase pump?,Endothelium.
Ophthalmology,Part-1 Cornea & Sclera,KF Rings,"In Wilson's disease, hepatic involvement is seen in what percent of KF-ring patients?",~50%.
Ophthalmology,Part-1 Cornea & Sclera,KF Rings,"In Wilson's disease, neurological involvement is seen in what percent of KF-ring patients?",~90%.
Ophthalmology,Part-2 Neuro-ophthalmology,Light Reflex Pathway,Which nerves carry the postganglionic parasympathetic fibres to the eye?,The short ciliary nerves.
Ophthalmology,Part-2 Neuro-ophthalmology,Visual Field Defects,What is Anton syndrome?,"Denial of (cortical) blindness, seen with PCA infarct / macular sparing."
Ophthalmology,Part-2 Neuro-ophthalmology,Visual Field Defects,Bitemporal hemianopia localizes a lesion to where?,The optic chiasma.
Ophthalmology,Part-2 Neuro-ophthalmology,Visual Field Defects,Contralateral homonymous hemianopia localizes a lesion to where?,The optic tract.
Ophthalmology,Part-2 Neuro-ophthalmology,Visual Field Defects,Homonymous hemianopia with macular sparing localizes to where?,The occipital cortex (PCA infarct).
Ophthalmology,Part-2 Neuro-ophthalmology,Optic Atrophy,Which optic atrophy is preceded by previous disc swelling?,Secondary optic atrophy (primary and consecutive are not).
Ophthalmology,Part-2 Neuro-ophthalmology,Optic Atrophy,Which optic atrophy has a chalky white disc?,Primary optic atrophy.
Ophthalmology,Part-2 Neuro-ophthalmology,Optic Atrophy,Which optic atrophy has a grey disc?,Secondary optic atrophy.
Ophthalmology,Part-2 Neuro-ophthalmology,Optic Atrophy,Which optic atrophy has a waxy pale disc?,Consecutive optic atrophy.
Ophthalmology,Part-2 Neuro-ophthalmology,Altitudinal Field Defects,Amaurosis fugax classically precedes which condition?,AION (giant cell arteritis).
Ophthalmology,Part-2 Neuro-ophthalmology,Marcus Gunn Pupil,"What does RAPD stand for, and which sign demonstrates it?",Relative afferent pupillary defect; shown by the Marcus Gunn pupil on swinging flashlight test.
Ophthalmology,Part-3 Retina,Macular Disorders,What does OCT stand for?,Optical coherence tomography.
Ophthalmology,Part-3 Retina,Macular Disorders,What does FFA stand for?,Fundus fluorescein angiography.
Ophthalmology,Part-3 Retina,Anti-VEGF,What is the mnemonic for the anti-VEGF agents?,"'BEVA ta RANI BRO, PEG pike AFIB hogya' - Bevacizumab, Ranibizumab, Brolucizumab, Pegaptanib, Aflibercept."
Ophthalmology,Part-3 Retina,Hypertensive Retinopathy,Name the fundus signs of hypertensive retinopathy.,"Arteriolar attenuation/narrowing, AV nicking, copper wiring, cotton-wool spots, exudates, blot hemorrhages, disc edema."
Ophthalmology,Part-3 Retina,Hypertensive Retinopathy,What is 'copper wiring' a sign of?,Hypertensive retinopathy.
Ophthalmology,Part-3 Retina,Retinal Detachment,A horseshoe (U-shaped) break is associated with which type of RD?,Rhegmatogenous retinal detachment.
Ophthalmology,Part-3 Retina,Retinoblastoma,"What is the most common clinical feature of retinoblastoma, and the next most common?","Leukocoria, followed by squint (esotropia)."
Ophthalmology,Part-3 Retina,Retinoblastoma,Which squint type is seen in retinoblastoma?,Esotropia.
Ophthalmology,Part-3 Retina,Central Serous Retinopathy,Verteporfin is used in which conditions?,Wet ARMD and central serous retinopathy (CSR).
Ophthalmology,Part-3 Retina,Best Disease,Which disease shows an egg-yolk appearance?,Best disease.
Ophthalmology,Part-3 Retina,CMV Retinitis,Which retinitis shows a pizza-pie appearance?,CMV retinitis.
Ophthalmology,Part-3 Retina,Toxoplasmosis,Which infection shows a headlight-in-fog appearance?,Ocular toxoplasmosis.
Ophthalmology,Part-3 Retina,Congenital Infections,Which congenital infections cause salt-and-pepper retinopathy?,Congenital rubella or syphilis.
Ophthalmology,Part-3 Retina,CRVO,Which condition shows a splashed-tomato fundus appearance?,Central retinal vein occlusion (CRVO).
Ophthalmology,Part-3 Retina,CRVO,100-day glaucoma develops after which condition?,CRVO (due to neovascularization).
Ophthalmology,Part-3 Retina,Retinitis Pigmentosa,Bony spicules on fundus indicate which disease?,Retinitis pigmentosa.
Ophthalmology,Part-3 Retina,Retinitis Pigmentosa,Decreased docosahexaenoic acid (DHA) is seen in which disease?,Retinitis pigmentosa.
Ophthalmology,Part-3 Retina,Stargardt Disease,A 'silent choroid' and fish-flecks indicate which disease?,Stargardt disease.
Ophthalmology,Part-3 Retina,Oguchi Disease,The Mizuo-Nakamura phenomenon is seen in which disease?,Oguchi disease (congenital stationary night blindness).
Ophthalmology,Part-3 Retina,Retinoblastoma,True rosettes with an empty centre (Flexner-Wintersteiner) are seen in which tumor?,Retinoblastoma.
Ophthalmology,Part-3 Retina,Retinoblastoma,"Which rosettes contain neuropil in the centre, and in which tumors?","Homer Wright rosettes - retinoblastoma, medulloblastoma, Ewing's sarcoma."
Ophthalmology,Part-3 Retina,ARMD,AREDS2 supplementation is used for which condition?,ARMD (in patients with drusen).
Ophthalmology,Part-3 Retina,Retinal Layers,Which retinal cells are the 2nd-order neurons?,Bipolar cells (in the inner nuclear layer).
Ophthalmology,Part-3 Retina,ERG,"Which ERG wave corresponds to photoreceptors, and which to bipolar cells?",a-wave = photoreceptors; b-wave = bipolar cells.
Ophthalmology,"Part-4 Uvea, Conjunctiva & Trachoma",VKH Syndrome,Which condition causes a sunset-glow fundus?,VKH syndrome.
Ophthalmology,"Part-4 Uvea, Conjunctiva & Trachoma",VKH Syndrome,A granulomatous panuveitis with perilimbal vitiligo suggests which syndrome?,VKH syndrome.
Ophthalmology,"Part-4 Uvea, Conjunctiva & Trachoma",Vernal Keratoconjunctivitis,A shield ulcer is associated with which condition?,Vernal keratoconjunctivitis (VKC).
Ophthalmology,"Part-4 Uvea, Conjunctiva & Trachoma",Vernal Keratoconjunctivitis,Cobblestone papillae are seen in which condition?,Vernal keratoconjunctivitis (VKC).
Ophthalmology,"Part-4 Uvea, Conjunctiva & Trachoma",Vernal Keratoconjunctivitis,Horner-Tranta dots are seen in which condition?,Vernal keratoconjunctivitis (VKC).
Ophthalmology,"Part-4 Uvea, Conjunctiva & Trachoma",Vernal Keratoconjunctivitis,The Maxwell-Lyon sign is seen in which condition?,Vernal keratoconjunctivitis (VKC).
Ophthalmology,"Part-4 Uvea, Conjunctiva & Trachoma",Keratic Precipitates,Mutton-fat KPs indicate which category of uveitis?,Granulomatous uveitis.
Ophthalmology,"Part-4 Uvea, Conjunctiva & Trachoma",Trachoma,What does TF stand for in FISTO grading?,Trachomatous inflammation - follicular.
Ophthalmology,"Part-4 Uvea, Conjunctiva & Trachoma",Trachoma,What does TI stand for in FISTO grading?,Trachomatous inflammation - intense.
Ophthalmology,"Part-4 Uvea, Conjunctiva & Trachoma",Trachoma,What does TS stand for in FISTO grading?,Trachomatous scarring.
Ophthalmology,"Part-4 Uvea, Conjunctiva & Trachoma",Trachoma,What does TT stand for in FISTO grading?,Trachomatous trichiasis.
Ophthalmology,"Part-4 Uvea, Conjunctiva & Trachoma",Trachoma,What does CO stand for in FISTO grading?,Corneal opacity.
Ophthalmology,"Part-4 Uvea, Conjunctiva & Trachoma",Pterygium,What is the role of mitomycin C / conjunctival autograft in pterygium?,To reduce recurrence.
Ophthalmology,"Part-4 Uvea, Conjunctiva & Trachoma",Uveitis,Which uveitis presents as a painful red eye with loss of vision?,Anterior uveitis.
Ophthalmology,"Part-4 Uvea, Conjunctiva & Trachoma",Uveitis,Which uveitis presents as painless loss of vision with floaters?,Posterior uveitis.
Ophthalmology,Part-5 Glaucoma,Anti-Glaucoma Drugs,How does netarsudil lower IOP?,By increasing trabecular outflow.
Ophthalmology,Part-5 Glaucoma,Anti-Glaucoma Drugs,Which drug class is the drug of choice and increases uveoscleral outflow?,Prostaglandin (PGF2-alpha) analogues.
Ophthalmology,Part-5 Glaucoma,Anti-Glaucoma Drugs,Which anti-glaucoma drug causes a black conjunctiva?,Dipivefrine.
Ophthalmology,Part-5 Glaucoma,Anti-Glaucoma Drugs,Which anti-glaucoma drug causes vortex keratopathy?,Netarsudil.
Ophthalmology,Part-5 Glaucoma,Anti-Glaucoma Drugs,Which anti-glaucoma drug class can cause corneal anaesthesia?,Ocular beta-blockers.
Ophthalmology,Part-5 Glaucoma,Angle Closure Glaucoma,Glaucomflecken indicate a previous episode of what?,Acute angle closure glaucoma.
Ophthalmology,Part-5 Glaucoma,Glaucoma Field Defects,Which scotoma is regarded as the earliest glaucomatous damage?,Bjerrum/arcuate scotoma.
Ophthalmology,Part-5 Glaucoma,Tonometry,"Which tonometer is the gold standard, and on what principle?",Goldmann applanation tonometer; Imbert-Fick principle (P = F/A).
Ophthalmology,Part-5 Glaucoma,Gonioscope Structures,Which gonioscope structure corresponds to the cornea at Descemet's membrane?,Schwalbe's line.
Ophthalmology,Part-6 Lens & Cataract,Cataract Morphology,A snowflake cataract is seen in which patients?,Diabetics (sorbitol accumulation).
Ophthalmology,Part-6 Lens & Cataract,Cataract Morphology,A sunflower cataract is seen in which conditions?,Wilson's disease and chalcosis (copper).
Ophthalmology,Part-6 Lens & Cataract,Cataract Morphology,A Christmas tree cataract is seen in which condition?,Myotonic dystrophy.
Ophthalmology,Part-6 Lens & Cataract,Cataract Morphology,Which is the most common congenital cataract?,Blue dot cataract.
Ophthalmology,Part-6 Lens & Cataract,Cataract Morphology,Which congenital cataract most commonly leads to diminution of vision?,Lamellar/zonular cataract.
Ophthalmology,Part-6 Lens & Cataract,Cataract Morphology,Which cataract appears polychromatic / breadcrumb-like?,Complicated cataract.
Ophthalmology,Part-6 Lens & Cataract,Cataract Surgery,A Sommering ring is associated with which complication?,Posterior capsular opacification (PCO).
Ophthalmology,Part-6 Lens & Cataract,Nuclear Cataract,The 'second sight' phenomenon occurs in which cataract?,Nuclear cataract.
Ophthalmology,Part-6 Lens & Cataract,Cataract Surgery,Most common chronic complication of cataract surgery?,PCO (posterior capsular opacification).
Ophthalmology,Part-6 Lens & Cataract,Cataract Surgery,What wavelength does the Nd:Glass laser use in FLACS (cataract slide)?,1054 nm. [Note: the laser slide lists Nd:Glass as 1053 nm.]
Ophthalmology,Part-7 Surgical Instruments,Instruments,Which dye stains the anterior lens capsule?,Trypan blue.
Ophthalmology,Part-7 Surgical Instruments,Instruments,Which IOL material is rigid (non-foldable)?,PMMA.
Ophthalmology,Part-7 Surgical Instruments,Instruments,Which instrument performs continuous curvilinear capsulorrhexis (CCC)?,Cystitome.
Ophthalmology,Part-7 Surgical Instruments,Instruments,Which instrument is used to create a bridle suture?,Superior rectus holding forceps.
Ophthalmology,Part-7 Surgical Instruments,Hordeolum,Inflammation of the Zeis gland is which condition?,External hordeolum.
Ophthalmology,Part-7 Surgical Instruments,Hordeolum,Acute inflammation of the meibomian gland is which condition?,Internal hordeolum.
Ophthalmology,Part-7 Surgical Instruments,Chalazion,Chronic granulomatous inflammation of the meibomian gland is called?,Chalazion.
Ophthalmology,"Part-8 Lacrimal, Trauma & Orbit",Sympathetic Ophthalmia,Dalen-Fuchs nodules are characteristic of which condition?,Sympathetic ophthalmia.
Ophthalmology,"Part-8 Lacrimal, Trauma & Orbit",Watering Eye,A negative Jones dye test 2 (opacify-) indicates what?,Pump failure.
Ophthalmology,"Part-8 Lacrimal, Trauma & Orbit",Watering Eye,A positive Jones dye test 2 (opacify+) indicates what?,Partial obstruction.
Ophthalmology,"Part-8 Lacrimal, Trauma & Orbit",Iron Lines,Iron deposition around a pterygium forms which line?,Stocker's line.
Ophthalmology,"Part-8 Lacrimal, Trauma & Orbit",Iron Lines,Iron deposition around a filtering bleb forms which line?,Ferry's line.
Ophthalmology,"Part-8 Lacrimal, Trauma & Orbit",Orbital Tumors,Most common malignant primary orbital tumor in a child?,Rhabdomyosarcoma.
Ophthalmology,"Part-8 Lacrimal, Trauma & Orbit",Orbital Tumors,Most common malignant orbital tumor in an adult?,Non-Hodgkin lymphoma (NHL).
Ophthalmology,"Part-8 Lacrimal, Trauma & Orbit",Orbital Metastasis,Most common cause of orbital metastasis in an adult?,Breast carcinoma.
Ophthalmology,Part-9 Strabismus & Ocular Motility,Fourth Nerve Palsy,Which cranial nerve palsy causes a compensatory head tilt?,Fourth (trochlear) nerve palsy.
Ophthalmology,Part-9 Strabismus & Ocular Motility,Ptosis Localization,Which muscle is responsible for the ptosis in Horner's syndrome?,Muller's muscle.
Ophthalmology,Part-9 Strabismus & Ocular Motility,Ptosis Localization,Which muscle is responsible for the ptosis in third nerve palsy?,Levator palpebrae superioris (LPS).
Ophthalmology,Part-9 Strabismus & Ocular Motility,Squint Tests,"In the Worth 4-dot test, what do uncrossed vs crossed diplopia indicate?",Uncrossed diplopia = eso deviation; crossed diplopia = exo deviation.
Ophthalmology,Part-9 Strabismus & Ocular Motility,EOM Actions,Which muscle is the primary intortor of the eye?,Superior oblique.
Ophthalmology,Part-9 Strabismus & Ocular Motility,EOM Actions,Which muscle is the primary extortor of the eye?,Inferior oblique.
Ophthalmology,Part-9 Strabismus & Ocular Motility,EOM Actions,Which muscle has primary elevation with secondary intorsion?,Superior rectus.
Ophthalmology,Part-9 Strabismus & Ocular Motility,EOM Actions,Which muscle has primary depression with secondary extorsion?,Inferior rectus.
Ophthalmology,Part-9 Strabismus & Ocular Motility,Squint Laws,Which law states yoke muscles receive equal innervation?,Hering's law.
Ophthalmology,Part-9 Strabismus & Ocular Motility,Squint Laws,Which law concerns reciprocal inhibition of the antagonist?,Sherrington's law.
Ophthalmology,Part-9 Strabismus & Ocular Motility,Squint Types,A squint where the second deviation exceeds the first is what type?,Paralytic squint.
Ophthalmology,Part-10 Refraction,Astigmatism,"In astigmatism notation, what relationship between cylinder and sphere is highlighted (per notes)?",Cylindrical power > spherical power.
Ophthalmology,Part-10 Refraction,High Myopia,Foster-Fuchs spots are seen in which condition?,High (pathological) myopia.
Ophthalmology,Part-10 Refraction,High Myopia,Lacquer cracks are seen in which condition?,High (pathological) myopia.
Ophthalmology,Part-10 Refraction,Hypermetropia,A shot-silk (shiny) retina is seen in which refractive error?,Hypermetropia.
Ophthalmology,Part-10 Refraction,Myopia Types,Keratoconus causes which type of myopia?,Curvature myopia.
Ophthalmology,Part-10 Refraction,Myopia Types,Nuclear cataract causes which type of myopia?,Index myopia.
Ophthalmology,Part-10 Refraction,Myopia Types,Weil-Marchesani syndrome causes which type of myopia?,Positional myopia.
Ophthalmology,Part-10 Refraction,Astigmatism,"In 'with the rule' astigmatism, which meridian is more curved?",The vertical meridian.
Ophthalmology,Part-10 Refraction,Astigmatism,"In 'against the rule' astigmatism, which meridian is more curved?",The horizontal meridian.
Ophthalmology,Part-11 Community Ophthalmology & Miscellaneous,NPCB,What does NPCB stand for?,National Programme for Control of Blindness & Visual Impairment.
Ophthalmology,Part-11 Community Ophthalmology & Miscellaneous,Steroid Side Effects,What does the GTCS mnemonic mean for steroid side effects?,Glaucoma from Topical steroids; Cataract from Systemic steroids.
Ophthalmology,Part-11 Community Ophthalmology & Miscellaneous,Lasers,Which laser (and wavelength) is used for photoablation / LASIK?,"Argon fluoride excimer laser, 193 nm."
Ophthalmology,Part-11 Community Ophthalmology & Miscellaneous,Lasers,A 532 nm laser is used for which process?,Photocoagulation (PRP and laser trabeculoplasty).
Ophthalmology,Part-11 Community Ophthalmology & Miscellaneous,Lasers,A 1064 nm Nd:YAG laser is used for which procedures?,Photodisruption - peripheral iridotomy and treating posterior capsular opacification.
Ophthalmology,Part-11 Community Ophthalmology & Miscellaneous,Eyelid Fusion,Fusion of the bulbar and palpebral conjunctiva is called?,Symblepharon.
Ophthalmology,Part-11 Community Ophthalmology & Miscellaneous,Eyelid Fusion,Fusion of the superior and inferior eyelids is called?,Ankyloblepharon.
Ophthalmology,Part-11 Community Ophthalmology & Miscellaneous,Eyelid,Eyelid coloboma leads to which complication?,Exposure keratitis.
