subject,deck,topic,front,back
Ophthalmology,Part-1 Cornea & Sclera,Corneal Anatomy,What are the layers of the cornea from anterior to posterior?,"Epithelium, Bowman's membrane, Stroma, Dua's layer, Descemet's membrane, Endothelium."
Ophthalmology,Part-1 Cornea & Sclera,Corneal Anatomy,What type of epithelium lines the cornea?,Non-keratinized stratified squamous epithelium.
Ophthalmology,Part-1 Cornea & Sclera,Corneal Anatomy,Which corneal layer does NOT regenerate?,Bowman's membrane.
Ophthalmology,Part-1 Cornea & Sclera,Corneal Anatomy,"How are the corneal stromal fibres arranged, and what does this provide?","Parallel fibre arrangement, which contributes to corneal transparency."
Ophthalmology,Part-1 Cornea & Sclera,Corneal Anatomy,Which glycosaminoglycan (GAG) is found in the corneal stroma?,Keratan sulfate.
Ophthalmology,Part-1 Cornea & Sclera,Corneal Anatomy,Which is the strongest layer of the cornea?,Dua's layer.
Ophthalmology,Part-1 Cornea & Sclera,Corneal Anatomy,In which corneal layer does copper deposit in Wilson's disease?,Descemet's membrane.
Ophthalmology,Part-1 Cornea & Sclera,Corneal Anatomy,Which is the most metabolically active layer of the cornea?,Endothelium.
Ophthalmology,Part-1 Cornea & Sclera,Corneal Anatomy,"Which corneal layer contributes maximally to corneal transparency, and how?",Endothelium - by keeping the cornea in a dehydrated state.
Ophthalmology,Part-1 Cornea & Sclera,Corneal Anatomy,Which ion pump does the corneal endothelium use to maintain dehydration?,Na+-K+-ATPase pump.
Ophthalmology,Part-1 Cornea & Sclera,Corneal Anatomy,Is the cornea vascular or avascular?,Avascular.
Ophthalmology,Part-1 Cornea & Sclera,Corneal Blink Reflex,What are the afferent and efferent limbs of the corneal blink reflex?,"Afferent = V1; Efferent = VII (facial nerve), bilateral."
Ophthalmology,Part-1 Cornea & Sclera,Corneal Anesthesia,List the causes of corneal anesthesia (reduced corneal sensation).,"HSV-1, leprosy, diabetes mellitus, beta-blockers."
Ophthalmology,Part-1 Cornea & Sclera,Interstitial Keratitis,List the causes of interstitial keratitis (IK).,"Cogan's syndrome (IK + SNHL), leprosy, TB, congenital syphilis."
Ophthalmology,Part-1 Cornea & Sclera,Interstitial Keratitis,What is Cogan's syndrome?,Interstitial keratitis + sensorineural hearing loss (SNHL).
Ophthalmology,Part-1 Cornea & Sclera,Interstitial Keratitis,What is Hutchinson's triad of congenital syphilis?,"Interstitial keratitis, SNHL, and peg-shaped incisors."
Ophthalmology,Part-1 Cornea & Sclera,Corneal Opacities,"Through a NEBULA, are the pupillary margin and iris visible?",Yes - both pupillary margin and iris are visible (faintest opacity).
Ophthalmology,Part-1 Cornea & Sclera,Corneal Opacities,"Through a MACULA, what is visible?","Pupillary margin is visible, but the iris is not."
Ophthalmology,Part-1 Cornea & Sclera,Corneal Opacities,"Which corneal opacity is the most severe, and what is visible through it?",Leukoma - neither the pupillary margin nor the iris is visible.
Ophthalmology,Part-1 Cornea & Sclera,Corneal Opacities,Order the three corneal opacities from least to most dense.,Nebula (faintest) -> Macula -> Leukoma (most severe).
Ophthalmology,Part-1 Cornea & Sclera,Corneal Dystrophy,General features of corneal dystrophies: inflammatory? progressive? bilateral? inherited?,Inflammatory: No; Progressive: Yes; Bilateral: Yes; Inherited: Yes.
Ophthalmology,Part-1 Cornea & Sclera,Corneal Dystrophy,What is the usual inheritance pattern of corneal dystrophies?,Autosomal dominant.
Ophthalmology,Part-1 Cornea & Sclera,Corneal Dystrophy,Which corneal dystrophy is X-linked recessive (exception to AD)?,Lisch epithelial dystrophy.
Ophthalmology,Part-1 Cornea & Sclera,Corneal Dystrophy,Which corneal dystrophies are autosomal recessive (exception to AD)?,Congenital and posterior endothelial dystrophy.
Ophthalmology,Part-1 Cornea & Sclera,Corneal Dystrophy,"Which is the most common corneal epithelial dystrophy, and its hallmark?",Cogan's epithelial dystrophy (most common) - 'fingerprint' defects.
Ophthalmology,Part-1 Cornea & Sclera,Corneal Dystrophy,What deposit characterizes lattice stromal dystrophy?,Amyloid deposition.
Ophthalmology,Part-1 Cornea & Sclera,Corneal Dystrophy,What deposit and appearance characterize granular dystrophy?,Stromal hyaline deposition; 'bread crumb' appearance.
Ophthalmology,Part-1 Cornea & Sclera,Corneal Investigations,What does specular microscopy measure?,Endothelial cell count.
Ophthalmology,Part-1 Cornea & Sclera,Corneal Investigations,What is the normal corneal endothelial cell count?,2500-3000 cells.
Ophthalmology,Part-1 Cornea & Sclera,Corneal Investigations,An endothelial cell count below 500 leads to what?,"Bullous keratopathy (fluid in the cornea), leading to corneal opacification."
Ophthalmology,Part-1 Cornea & Sclera,Corneal Investigations,What does pachymetry measure?,Corneal thickness.
Ophthalmology,Part-1 Cornea & Sclera,Corneal Investigations,What does keratometry measure?,Corneal curvature.
Ophthalmology,Part-1 Cornea & Sclera,Corneal Investigations,Which structure contributes maximally to the power of the eye?,The cornea (its curvature).
Ophthalmology,Part-1 Cornea & Sclera,Corneal Investigations,"If the eye's total refractive power is 60D, how much does the cornea contribute?",45 D.
Ophthalmology,Part-1 Cornea & Sclera,Corneal Investigations,What is the Placido disc used to assess?,The corneal surface.
Ophthalmology,Part-1 Cornea & Sclera,Corneal Investigations,What does the Pentacam assess?,The corneal surface.
Ophthalmology,Part-1 Cornea & Sclera,Ocular Biometry,What is the axial length of the eye (per notes)?,25 mm.
Ophthalmology,Part-1 Cornea & Sclera,Ocular Biometry,What is the depth of the anterior chamber (per notes)?,2.5 mm.
Ophthalmology,Part-1 Cornea & Sclera,Ocular Biometry,What dioptric difference between the two eyes defines anisometropia?,A difference greater than 2.5 D.
Ophthalmology,Part-1 Cornea & Sclera,Ocular Biometry,What is the normal refractive state from newborn till infancy?,Hypermetropia of about +2.5 D.
Ophthalmology,Part-1 Cornea & Sclera,Corneal Infections,"A sterile, mobile hypopyon suggests which type of corneal infection?",Bacterial.
Ophthalmology,Part-1 Cornea & Sclera,Corneal Infections,"A non-sterile (asterile), immobile hypopyon suggests which type of corneal infection?",Fungal.
Ophthalmology,Part-1 Cornea & Sclera,Corneal Infections,"Which organism causes contact-lens-related corneal ulcers, and how fast can it perforate?",Pseudomonas - can perforate the cornea within 48 hours.
Ophthalmology,Part-1 Cornea & Sclera,Corneal Infections,What does Seidel's test detect?,Corneal perforation - aqueous humor leak.
Ophthalmology,Part-1 Cornea & Sclera,Corneal Infections,"Wesley's ring, satellite lesions, and history of trauma with vegetative matter suggest which infection?",Fungal keratitis.
Ophthalmology,Part-1 Cornea & Sclera,Corneal Infections,A ring abscess with a history of contact lens misuse suggests which infection?,Acanthamoeba keratitis.
Ophthalmology,Part-1 Cornea & Sclera,Acanthamoeba,What are the characteristic clinical features of Acanthamoeba keratitis?,Severe pain (+++) and neuritis (++).
Ophthalmology,Part-1 Cornea & Sclera,Acanthamoeba,What is the drug of choice for Acanthamoeba keratitis?,PHMB (a biguanide).
Ophthalmology,Part-1 Cornea & Sclera,Corneal Infections,List the causes of satellite lesions.,"H. influenzae, breast Ca (T4b), borderline tuberculoid (BT) leprosy, fungal corneal ulcer."
Ophthalmology,Part-1 Cornea & Sclera,Corneal Stains,Which stain is used first and stains the floor of a corneal ulcer?,Fluorescein (stains the floor).
Ophthalmology,Part-1 Cornea & Sclera,Corneal Stains,Which stains highlight the margin of a corneal ulcer?,Lissamine green and rose bengal.
Ophthalmology,Part-1 Cornea & Sclera,Corneal Stains,Fluorescein is best viewed with which filter?,Cobalt blue filter.
Ophthalmology,Part-1 Cornea & Sclera,Viral Keratitis,What is the most common cause of viral keratitis?,HSV-1.
Ophthalmology,Part-1 Cornea & Sclera,Viral Keratitis,"In superficial punctate keratopathy (SPK), are steroids allowed?",Yes - steroids are indicated/allowed.
Ophthalmology,Part-1 Cornea & Sclera,Viral Keratitis,"How is a dendritic ulcer treated, and what is contraindicated?",Treat with acyclovir; steroids are contraindicated.
Ophthalmology,Part-1 Cornea & Sclera,Viral Keratitis,"What is the side-effect concern with steroids in herpetic keratitis, and the duration limit?",Metaherpetic keratitis; if steroids are used they should be limited to under 2 weeks.
Ophthalmology,Part-1 Cornea & Sclera,Viral Keratitis,What are the features of VZV keratitis?,Pseudo-dendritic ulcer; painful vesicles in V1 distribution; Hutchinson's sign present.
Ophthalmology,Part-1 Cornea & Sclera,Keratoconus,Name the signs associated with keratoconus.,"Munson sign, Vogt's striae, Fleischer ring, Rizutti sign, oil droplet sign, scissoring reflex."
Ophthalmology,Part-1 Cornea & Sclera,Keratoconus,What is the orientation of Vogt's striae in keratoconus?,Vertical.
Ophthalmology,Part-1 Cornea & Sclera,Keratoconus,"What is the Fleischer ring composed of, and where?",Iron (Fe) deposition in the corneal epithelium.
Ophthalmology,Part-1 Cornea & Sclera,Keratoconus,On which examinations are the oil droplet sign and scissoring reflex seen?,Oil droplet - ophthalmoscopy; scissoring reflex - retinoscopy.
Ophthalmology,Part-1 Cornea & Sclera,Keratoconus,What corneal changes characterize keratoconus?,Irregular corneal thickness and irregular astigmatism.
Ophthalmology,Part-1 Cornea & Sclera,Keratoconus,What are INTACS used for?,They are a treatment (intrastromal ring segments) for keratoconus.
Ophthalmology,Part-1 Cornea & Sclera,Keratoconus,What is C3R?,Corneal collagen cross-linking with riboflavin.
Ophthalmology,Part-1 Cornea & Sclera,KF Rings,Where does copper deposit in a KF ring?,Descemet's membrane.
Ophthalmology,Part-1 Cornea & Sclera,KF Rings,KF rings are associated with which disease?,Wilson's disease.
Ophthalmology,Part-1 Cornea & Sclera,KF Rings,"In Wilson's disease, what percent of KF-ring patients have hepatic vs neurological involvement?",~50% hepatic involvement; ~90% neurological involvement.
Ophthalmology,Part-1 Cornea & Sclera,Scleritis vs Episcleritis,Compare pain in scleritis vs episcleritis.,Scleritis - markedly increased pain; episcleritis - lesser pain compared to scleritis.
Ophthalmology,Part-1 Cornea & Sclera,Scleritis vs Episcleritis,Compare the response to 2.5% phenylephrine in scleritis vs episcleritis.,Scleritis - no blanching; episcleritis - blanching positive.
Ophthalmology,Part-1 Cornea & Sclera,Scleritis vs Episcleritis,Scleritis is associated with which systemic disease?,Rheumatoid arthritis (RA).
Ophthalmology,Part-1 Cornea & Sclera,Scleromalacia Perforans,Scleromalacia perforans is associated with what history?,History of rheumatoid arthritis (RA).
Ophthalmology,Part-1 Cornea & Sclera,Scleromalacia Perforans,"If there is no history of RA, what does the scleral thinning lead to?",Staphyloma.
Ophthalmology,Part-1 Cornea & Sclera,Ophthalmic Anesthesia,Which agent is used for injectable LA vs topical anesthesia in ophthalmology?,Injectable LA: lignocaine; Topical: proparacaine.
Ophthalmology,Part-1 Cornea & Sclera,Ophthalmic Anesthesia,Which block is given in the extraconal space?,Peribulbar block.
Ophthalmology,Part-1 Cornea & Sclera,Ophthalmic Anesthesia,Which block is given in the intraconal space?,Retrobulbar block.
Ophthalmology,Part-1 Cornea & Sclera,Ophthalmic Anesthesia,Where are the subtenon and subconjunctival blocks placed?,Subtenon block - beneath Tenon's capsule (episcleral level); subconjunctival block - beneath the conjunctiva.
Ophthalmology,Part-1 Cornea & Sclera,Keratoplasty,What is penetrating keratoplasty (PK)?,Keratoplasty in which all corneal layers are replaced (full thickness).
Ophthalmology,Part-1 Cornea & Sclera,Keratoplasty,"What does DALK stand for, and which layers are replaced?",Deep Anterior Lamellar Keratoplasty - cornea replaced up to the mid-stroma.
Ophthalmology,Part-1 Cornea & Sclera,Keratoplasty,"What does DSEK stand for, and what is preserved?",Descemet Stripping with Endothelial Keratoplasty - the stroma is not disturbed.
Ophthalmology,Part-1 Cornea & Sclera,Keratoplasty,What are the indications for keratoplasty?,"Corneal ulcers, bullous keratopathy, keratoconus."
Ophthalmology,Part-1 Cornea & Sclera,Keratoplasty,Within how many hours of death should a corneal graft be taken from a cadaver?,Within 6 hours.
Ophthalmology,Part-1 Cornea & Sclera,Keratoplasty,What is the McCarey-Kauffman medium used for?,Corneal graft storage medium.
Ophthalmology,Part-1 Cornea & Sclera,Keratoplasty,What suture material is used in keratoplasty?,Nylon sutures.
Ophthalmology,Part-1 Cornea & Sclera,Keratoplasty,List the signs of corneal graft rejection.,"Kaye's dots (subepithelial), Khodadoust line, and keratic precipitates (KP)."
Ophthalmology,Part-1 Cornea & Sclera,Keratoplasty,Where are Kaye's dots located in graft rejection?,Subepithelial.
Ophthalmology,Part-2 Neuro-ophthalmology,Visual Field Defects,A lesion of the optic nerve produces what field defect?,Blindness (total field loss) of the ipsilateral eye.
Ophthalmology,Part-2 Neuro-ophthalmology,Visual Field Defects,A lesion at the optic chiasma produces what field defect?,Bitemporal hemianopia.
Ophthalmology,Part-2 Neuro-ophthalmology,Visual Field Defects,A lesion of the optic tract produces what field defect?,Contralateral homonymous hemianopia.
Ophthalmology,Part-2 Neuro-ophthalmology,Visual Field Defects,A lesion of the temporal lobe (Meyer's loop) produces what field defect?,Contralateral superior quadrantanopia.
Ophthalmology,Part-2 Neuro-ophthalmology,Visual Field Defects,A lesion of the parietal lobe (Baum's loop) produces what field defect?,Contralateral inferior quadrantanopia.
Ophthalmology,Part-2 Neuro-ophthalmology,Visual Field Defects,"What field defect results from a PCA infarct, and what syndrome is associated?",Homonymous hemianopia with macular sparing; Anton syndrome (denial of blindness).
Ophthalmology,Part-2 Neuro-ophthalmology,Visual Field Defects,An MCA lesion affects which part of vision?,The macula (central vision).
Ophthalmology,Part-2 Neuro-ophthalmology,Visual Field Defects,Wernicke's pupil localizes a lesion to where?,The optic tract.
Ophthalmology,Part-2 Neuro-ophthalmology,Visual Field Defects,"Which visual radiation passes through the temporal lobe, and what is it called?",Meyer's loop (temporal loop).
Ophthalmology,Part-2 Neuro-ophthalmology,Visual Field Defects,"Which visual radiation passes through the parietal lobe, and what is it called?",Baum's loop.
Ophthalmology,Part-2 Neuro-ophthalmology,Light Reflex Pathway,What is synapse #1 in the light reflex pathway?,Pretectal nucleus.
Ophthalmology,Part-2 Neuro-ophthalmology,Light Reflex Pathway,What is synapse #2 in the light reflex pathway?,Edinger-Westphal nucleus.
Ophthalmology,Part-2 Neuro-ophthalmology,Light Reflex Pathway,What is synapse #3 in the light reflex pathway?,Ciliary ganglion.
Ophthalmology,Part-2 Neuro-ophthalmology,Light Reflex Pathway,Where are the two decussations in the light reflex pathway?,Decussation #1 at the chiasm; decussation #2 at the posterior commissure.
Ophthalmology,Part-2 Neuro-ophthalmology,Light Reflex Pathway,What proportion of pupillary fibres are light vs near fibres?,Light fibres 3-5%; near fibres 95-97%.
Ophthalmology,Part-2 Neuro-ophthalmology,Light Reflex Pathway,Are the postganglionic parasympathetic fibres myelinated or unmyelinated?,Myelinated.
Ophthalmology,Part-2 Neuro-ophthalmology,Light Reflex Pathway,"Where do ipRGCs also synapse, and what function does this serve?",Suprachiasmatic nucleus of the hypothalamus - for diurnal rhythm.
Ophthalmology,Part-2 Neuro-ophthalmology,Light Reflex Pathway,Why is CN III vulnerable to compression in its subarachnoid course?,It runs superficial and dorsomedial - vulnerable to PComm aneurysm and uncal herniation.
Ophthalmology,Part-2 Neuro-ophthalmology,Argyll-Robertson Pupil,What are the reflex findings in Argyll-Robertson pupil?,Accommodation reflex present; light reflex absent.
Ophthalmology,Part-2 Neuro-ophthalmology,Marcus Gunn Pupil,What test detects a Marcus Gunn pupil (RAPD)?,Swinging flashlight test.
Ophthalmology,Part-2 Neuro-ophthalmology,Marcus Gunn Pupil,A Marcus Gunn pupil (RAPD) is the hallmark of what condition?,Optic neuritis.
Ophthalmology,Part-2 Neuro-ophthalmology,Marcus Gunn Pupil,"If RAPD/optic neuritis is found, what must always be ruled out?",Multiple sclerosis.
Ophthalmology,Part-2 Neuro-ophthalmology,Adie vs Pharmacological Pupil,Both cause an ipsilateral dilated pupil - how do they differ on accommodation?,Adie's: accommodation intact; pharmacological (atropine): cycloplegia (accommodation lost).
Ophthalmology,Part-2 Neuro-ophthalmology,Adie vs Pharmacological Pupil,How does 0.125% pilocarpine differentiate Adie's tonic pupil from pharmacological mydriasis?,Adie's: causes miosis (denervation hypersensitivity); pharmacological: no reversal (no constriction).
Ophthalmology,Part-2 Neuro-ophthalmology,Adie vs Pharmacological Pupil,What is the underlying defect in Adie's tonic pupil?,Denervation of the parasympathetic (light reflex) fibres.
Ophthalmology,Part-2 Neuro-ophthalmology,Adie vs Pharmacological Pupil,Which drug typically causes pharmacological mydriasis?,Atropine.
Ophthalmology,Part-2 Neuro-ophthalmology,Optic Atrophy,Disc colour in primary vs secondary vs consecutive optic atrophy?,Primary: chalky white; Secondary: grey; Consecutive: waxy pale.
Ophthalmology,Part-2 Neuro-ophthalmology,Optic Atrophy,Disc margins in primary vs secondary vs consecutive optic atrophy?,Primary: distinct; Secondary: blurred; Consecutive: normal with attenuated arteries.
Ophthalmology,Part-2 Neuro-ophthalmology,Optic Atrophy,Which type of optic atrophy is preceded by long-standing disc swelling?,Secondary optic atrophy.
Ophthalmology,Part-2 Neuro-ophthalmology,Optic Atrophy,In which type is there gliosis of the optic nerve head?,Secondary optic atrophy.
Ophthalmology,Part-2 Neuro-ophthalmology,Optic Atrophy,Causes of primary optic atrophy?,"Compression of optic nerve/chiasm, hereditary optic neuropathy, nutritional optic atrophy."
Ophthalmology,Part-2 Neuro-ophthalmology,Optic Atrophy,Which hereditary optic neuropathy is mitochondrial?,Leber's hereditary optic neuropathy (LHON).
Ophthalmology,Part-2 Neuro-ophthalmology,Optic Atrophy,Which vitamin deficiencies cause nutritional optic atrophy?,"Vitamin B6, B1, B3."
Ophthalmology,Part-2 Neuro-ophthalmology,Optic Atrophy,Tobacco causes which optic problem?,Toxic amblyopia.
Ophthalmology,Part-2 Neuro-ophthalmology,Optic Atrophy,Causes of secondary optic atrophy?,"Chronic papilloedema, papillitis, anterior ischemic optic neuropathy (AION - giant cell arteritis)."
Ophthalmology,Part-2 Neuro-ophthalmology,Optic Atrophy,Causes of consecutive optic atrophy?,"Chorioretinal disease (e.g., retinitis pigmentosa), central retinal artery occlusion."
Ophthalmology,Part-2 Neuro-ophthalmology,Optic Neuritis (MS),What is the most common type of optic neuritis in multiple sclerosis?,Retrobulbar neuritis.
Ophthalmology,Part-2 Neuro-ophthalmology,Optic Neuritis (MS),Clinical features of retrobulbar neuritis?,Painful unilateral loss of vision with no visual field defect and a normal fundus.
Ophthalmology,Part-2 Neuro-ophthalmology,Optic Neuritis (MS),What is the investigation of choice for retrobulbar neuritis?,Contrast-enhanced MRI (CE-MRI).
Ophthalmology,Part-2 Neuro-ophthalmology,Papilledema,Typical presentation of papilledema?,"Painless, bilateral."
Ophthalmology,Part-2 Neuro-ophthalmology,Papilledema,Visual field defects in papilledema?,Enlargement of the blind spot and central scotoma.
Ophthalmology,Part-2 Neuro-ophthalmology,Papilledema,What is contraindicated in raised ICP / papilledema?,Lumbar puncture.
Ophthalmology,Part-2 Neuro-ophthalmology,Altitudinal Field Defects,Name causes of altitudinal visual field defects.,"Glaucoma, optic nerve drusen, AION."
Ophthalmology,Part-2 Neuro-ophthalmology,Altitudinal Field Defects,"AION is associated with which condition, and what symptom may precede it?",Giant cell arteritis; amaurosis fugax.
Ophthalmology,Part-3 Retina,Retinal Layers,List the retinal layers from inner (vitreal) to outer.,"Internal limiting membrane, nerve fibre layer, ganglion cell layer, inner plexiform, inner nuclear, outer plexiform, outer nuclear (with OLM), photoreceptors, RPE; then choroid (Bruch membrane)."
Ophthalmology,Part-3 Retina,Retinal Layers,Which retinal layer contains the 3rd-order neurons?,Ganglion cell layer.
Ophthalmology,Part-3 Retina,Retinal Layers,"Which retinal layer contains the 2nd-order neurons, and which cells?","Inner nuclear layer - bipolar, Muller, amacrine, and horizontal cells."
Ophthalmology,Part-3 Retina,Retinal Layers,Which cells are the 1st-order neurons of the retina?,Photoreceptors.
Ophthalmology,Part-3 Retina,Retinal Layers,Retinal detachment occurs between which two layers?,Between the photoreceptors and the RPE.
Ophthalmology,Part-3 Retina,Retinal Layers,Which membrane is associated with the choroid?,Bruch membrane.
Ophthalmology,Part-3 Retina,Direct vs Indirect Ophthalmoscopy,Compare magnification: direct vs indirect (+20D).,Direct 14X; indirect 3X.
Ophthalmology,Part-3 Retina,Direct vs Indirect Ophthalmoscopy,Compare field diameter: direct vs indirect.,Direct 2 DD; indirect 9 DD.
Ophthalmology,Part-3 Retina,Direct vs Indirect Ophthalmoscopy,Compare image orientation: direct vs indirect.,Direct: erect/direct image; indirect: inverted and reversed.
Ophthalmology,Part-3 Retina,Direct vs Indirect Ophthalmoscopy,Compare view of periphery: direct vs indirect.,Direct: limited; indirect: full.
Ophthalmology,Part-3 Retina,Direct vs Indirect Ophthalmoscopy,Which provides stereopsis - direct or indirect?,Indirect (present); direct (absent).
Ophthalmology,Part-3 Retina,Retinal Blood Supply,What supplies the outer 4 retinal layers?,Short posterior ciliary artery.
Ophthalmology,Part-3 Retina,Retinal Blood Supply,What supplies the inner 6 retinal layers?,Central retinal artery.
Ophthalmology,Part-3 Retina,ERG,"In electroretinography, what does the a-wave represent?",Photoreceptors.
Ophthalmology,Part-3 Retina,ERG,"In electroretinography, what does the b-wave represent?",Bipolar cells.
Ophthalmology,Part-3 Retina,ERG,ERG is abnormal in which disease?,Retinitis pigmentosa.
Ophthalmology,Part-3 Retina,EOG,What is the normal Arden's ratio (light/dark) on EOG (per Retina slide)?,1.33.
Ophthalmology,Part-3 Retina,EOG,EOG (Arden's ratio) is decreased in which disease?,Best's disease.
Ophthalmology,Part-3 Retina,Macular Disorders,What does the Amsler grid detect?,Metamorphopsia.
Ophthalmology,Part-3 Retina,Macular Disorders,What appearances on fundus fluorescein angiography are described?,"Ink blot, dot-blot, and umbrella patterns."
Ophthalmology,Part-3 Retina,Central Serous Retinopathy,What are the risk factors for central serous retinopathy (CSR)?,Steroids and type A personality.
Ophthalmology,Part-3 Retina,Central Serous Retinopathy,What is the treatment of CSR?,Photodynamic therapy (PDT).
Ophthalmology,Part-3 Retina,Central Serous Retinopathy,Which drug is used in photodynamic therapy?,Verteporfin (used in wet ARMD and CSR).
Ophthalmology,Part-3 Retina,Cystoid Macular Edema,What FFA appearance characterizes cystoid macular edema?,Petalloid appearance.
Ophthalmology,Part-3 Retina,Cystoid Macular Edema,Which retinal layer is involved in cystoid macular edema?,Outer plexiform layer (OPL).
Ophthalmology,Part-3 Retina,Cystoid Macular Edema,List causes of cystoid macular edema.,"Irvine-Gass, PG analogues, diabetic retinopathy, uveitis, retinitis pigmentosa, CRVO, niacin toxicity."
Ophthalmology,Part-3 Retina,Blood-Retinal Barrier,"What forms the outer blood-retinal barrier, and which disease results from its breakdown?",RPE; breakdown causes CSR.
Ophthalmology,Part-3 Retina,Blood-Retinal Barrier,"What forms the inner blood-retinal barrier, and which disease results from its breakdown?",Capillary permeability (endothelium); breakdown causes CME.
Ophthalmology,Part-3 Retina,Diabetic Retinopathy,"What is the earliest sign of diabetic retinopathy, and in which layer?",Microaneurysm - in the inner nuclear layer (INL).
Ophthalmology,Part-3 Retina,Diabetic Retinopathy,Dot-and-blot hemorrhages and hard exudates are in which retinal layer?,Outer plexiform layer (OPL).
Ophthalmology,Part-3 Retina,Diabetic Retinopathy,Flame-shaped hemorrhages and cotton-wool/soft exudates are in which retinal layer?,Nerve fibre layer (NFL).
Ophthalmology,Part-3 Retina,Diabetic Retinopathy,When is DR screening started in type 1 vs type 2 diabetes?,Type 1: after 5 years; Type 2: immediately at diagnosis.
Ophthalmology,Part-3 Retina,Diabetic Retinopathy,Which is a stronger determinant of DR - duration or glycemic control?,Duration > glycemic control.
Ophthalmology,Part-3 Retina,Proliferative DR,What defines PDR?,Proliferation of new vessels (neoangiogenesis).
Ophthalmology,Part-3 Retina,Proliferative DR,What type of hemorrhage is seen in PDR?,Subhyaloid / boat-shaped hemorrhage.
Ophthalmology,Part-3 Retina,Proliferative DR,What is the treatment of PDR?,Panretinal photocoagulation.
Ophthalmology,Part-3 Retina,Proliferative DR,"Which laser is used for panretinal photocoagulation, and at what wavelength?",Frequency-doubled Nd:YAG; 532 nm.
Ophthalmology,Part-3 Retina,Severe NPDR,State the 4-2-1 rule for severe NPDR.,Greater than 20 intraretinal hemorrhages in each of 4 quadrants; definite venous beading in 2 or more quadrants; prominent IRMA in 1 or more quadrants (with no signs of PDR).
