subject,deck,topic,front,back
Ophthalmology,Part-3 Retina,Anti-VEGF,List the anti-VEGF agents used intravitreally.,"Bevacizumab, ranibizumab, brolucizumab, aflibercept, pegaptanib."
Ophthalmology,Part-3 Retina,Anti-VEGF,Where is an intravitreal injection given?,"4 mm above the temporal limbus, at a 90-degree angle."
Ophthalmology,Part-3 Retina,Hypertensive Retinopathy,"What is the normal arteriovenous (A:V) ratio, and in hypertension?",Normal A:V = 2:3; in HTN = 1:3.
Ophthalmology,Part-3 Retina,Hypertensive Retinopathy,Keith-Wagener grade 1?,Mild generalized retinal arteriolar narrowing.
Ophthalmology,Part-3 Retina,Hypertensive Retinopathy,Keith-Wagener grade 2?,Definite focal narrowing and arteriovenous nipping.
Ophthalmology,Part-3 Retina,Hypertensive Retinopathy,Keith-Wagener grade 3?,"Retinal hemorrhages, exudates, and cotton-wool spots."
Ophthalmology,Part-3 Retina,Hypertensive Retinopathy,Keith-Wagener grade 4?,Severe grade 3 retinopathy plus papilledema.
Ophthalmology,Part-3 Retina,AV Crossing Changes,What is the Salus sign?,S-shaped deflection of veins at the AV crossing.
Ophthalmology,Part-3 Retina,AV Crossing Changes,What is the Gunn sign?,Tapering of the vein at either end of the crossing.
Ophthalmology,Part-3 Retina,AV Crossing Changes,What is the Bonnet sign?,Dilatation of the vein at the crossing junction.
Ophthalmology,Part-3 Retina,CRAO,What is the classic fundus sign of central retinal artery occlusion?,Cherry-red spot.
Ophthalmology,Part-3 Retina,CRAO,List differentials for a cherry-red spot.,"Trauma (Berlin edema), Tay-Sachs disease, Niemann-Pick disease."
Ophthalmology,Part-3 Retina,CRAO,"What happens with cilioretinal artery sparing in CRAO, and how common is it?",Central (tunnel) vision is preserved; occurs in ~14%.
Ophthalmology,Part-3 Retina,CRVO,What is the classic fundus appearance of central retinal vein occlusion?,Splashed-tomato appearance.
Ophthalmology,Part-3 Retina,CRVO,What is '100-day glaucoma'?,Neovascular glaucoma developing after CRVO due to neovascularization.
Ophthalmology,Part-3 Retina,Roth Spots,"Roth spots are associated with which condition, and by what mechanism?",Infective endocarditis - an embolic phenomenon.
Ophthalmology,Part-3 Retina,Roth Spots,Describe Janeway lesions.,"Vascular, painless lesions on the palms."
Ophthalmology,Part-3 Retina,Roth Spots,Describe Osler's nodes.,"Painful, immunological lesions on the pulp of the fingers."
Ophthalmology,Part-3 Retina,Fundus Spotters,What does a 'sea fan' appearance indicate?,Sickle cell anemia (SCA).
Ophthalmology,Part-3 Retina,CMV Retinitis,What is the classic appearance of CMV retinitis?,Pizza-pie appearance.
Ophthalmology,Part-3 Retina,CMV Retinitis,CMV retinitis occurs in which patients (HIV CD4 count)?,HIV/AIDS patients with CD4 < 50.
Ophthalmology,Part-3 Retina,CMV Retinitis,What is the drug of choice for CMV retinitis?,Ganciclovir.
Ophthalmology,Part-3 Retina,Toxoplasmosis,What is the fundus appearance of ocular toxoplasmosis?,Headlight-in-fog appearance; leaves a macular scar.
Ophthalmology,Part-3 Retina,Congenital Infections,What causes salt-and-pepper retinopathy?,Congenital rubella or syphilis.
Ophthalmology,Part-3 Retina,Drusen,What are drusen composed of?,Lipofuscin deposition in the fundus.
Ophthalmology,Part-3 Retina,ARMD,"In dry ARMD, where are drusen located?",Between the RPE and Bruch membrane.
Ophthalmology,Part-3 Retina,Best Disease,What is the classic appearance of Best disease?,Egg-yolk appearance.
Ophthalmology,Part-3 Retina,Best Disease,What are the EOG findings in Best disease (and normal Arden ratio per this slide)?,EOG decreased; normal Arden ratio >1.85 (written 1:85). [Note: the Retina slide lists normal as 1.33 - source gives two values.]
Ophthalmology,Part-3 Retina,ARMD,What are the components of AREDS2 supplementation?,"Vitamin C, vitamin E, zinc, copper, lutein, zeaxanthin."
Ophthalmology,Part-3 Retina,Retinitis Pigmentosa,List the fundus features of retinitis pigmentosa.,"Arteriolar attenuation, waxy pale optic disc, bony spicules."
Ophthalmology,Part-3 Retina,Retinitis Pigmentosa,"In RP, are rods or cones affected more, and what is lost first?",Rods > cones; night vision is lost first.
Ophthalmology,Part-3 Retina,Retinitis Pigmentosa,What field defects occur in RP?,Ring scotoma and tunnel vision.
Ophthalmology,Part-3 Retina,Retinitis Pigmentosa,What is Usher syndrome?,Retinitis pigmentosa + sensorineural hearing loss.
Ophthalmology,Part-3 Retina,Retinitis Pigmentosa,Which fatty acid is decreased in RP?,Docosahexaenoic acid (DHA).
Ophthalmology,Part-3 Retina,Stargardt Disease,"In Stargardt disease, are cones or rods affected more?",Cones > rods.
Ophthalmology,Part-3 Retina,Stargardt Disease,List features of Stargardt disease.,"Silent choroid, fish flecks / copper-beaten appearance, ABCA4 gene mutation."
Ophthalmology,Part-3 Retina,Oguchi Disease,What phenomenon is seen in Oguchi disease (congenital stationary night blindness)?,Mizuo-Nakamura phenomenon.
Ophthalmology,Part-3 Retina,Retinal Detachment,"What characterizes rhegmatogenous RD, with its causes and symptom?",Caused by a retinal break (trauma/myopia/surgery); 'curtain falling in front of the eye.'
Ophthalmology,Part-3 Retina,Retinal Detachment,What characterizes exudative RD?,Tumor/pus cause; 'fluid shift'; dome-shaped RD (diagnosed on B-mode USG).
Ophthalmology,Part-3 Retina,Retinal Detachment,What characterizes tractional RD?,'Tent-shaped' RD.
Ophthalmology,Part-3 Retina,Retinal Detachment,What is inverse hypopyon?,Silicone oil leaking into the anterior chamber.
Ophthalmology,Part-3 Retina,Retinal Detachment,Name surgical treatments for RD.,Scleral buckling and pneumatic retinopexy (SF6 gas).
Ophthalmology,Part-3 Retina,Retinoblastoma,"What is the most common presenting feature of retinoblastoma, at what age?",Leukocoria; ages 1-5 years.
Ophthalmology,Part-3 Retina,Retinoblastoma,"What is the main differential of retinoblastoma, and its features?",PHPV - retrolental triangular opacity; hyaloid artery in Cloquet's canal.
Ophthalmology,Part-3 Retina,Retinoblastoma,What is the hallmark of retinoblastoma on CT scan?,Calcification (Ca2+).
Ophthalmology,Part-3 Retina,Retinoblastoma,What does B-mode USG show in retinoblastoma?,A retinal mass with calcifications (white dots).
Ophthalmology,Part-3 Retina,Retinoblastoma,What are Flexner-Wintersteiner rosettes?,True rosettes - cells arranged in a circle with an empty center.
Ophthalmology,Part-3 Retina,Retinoblastoma,"What are Homer Wright rosettes, and which tumors show them?","Rosettes with neuropil in the center; seen in RB, medulloblastoma, Ewing's sarcoma."
Ophthalmology,Part-3 Retina,Retinoblastoma,Which tumor shows perivascular rosettes (blood vessel in the center)?,Ependymoma.
Ophthalmology,Part-3 Retina,Retinoblastoma,What proportion of retinoblastoma is sporadic vs hereditary?,Sporadic 60%; hereditary 40%.
Ophthalmology,Part-3 Retina,Retinoblastoma,What proportion is familial vs non-familial?,Familial 7%; non-familial 33%.
Ophthalmology,Part-3 Retina,Retinoblastoma,What is the mode of inheritance and the gene/chromosome involved?,Autosomal dominant; RB gene on chromosome 13.
Ophthalmology,Part-3 Retina,Retinoblastoma,What is trilateral retinoblastoma?,Bilateral RB plus pinealoblastoma.
Ophthalmology,Part-3 Retina,Retinoblastoma,What is the investigation of choice for retinoblastoma?,Contrast-enhanced MRI (CE-MRI).
Ophthalmology,Part-3 Retina,Retinoblastoma,Which cancer is most commonly associated with retinoblastoma?,Osteosarcoma.
Ophthalmology,Part-3 Retina,Retinoblastoma,"What is the treatment for bilateral RB, and what is the VEC regimen?",Bilateral RB: neoadjuvant chemotherapy then surgery; VEC = vincristine + etoposide + carboplatin.
Ophthalmology,Part-3 Retina,Retinoblastoma,What does enucleation involve?,Removal of the globe along with the optic nerve. [Note: source labels this 'Sx for Neuroblastoma' - appears to be a slip for retinoblastoma.]
Ophthalmology,"Part-4 Uvea, Conjunctiva & Trachoma",Uveitis,"Which structures are involved in anterior uveitis, and its presentation/management?",Iris + ciliary body (pars plicata); painful red eye with loss of vision; managed with steroids + cycloplegics.
Ophthalmology,"Part-4 Uvea, Conjunctiva & Trachoma",Uveitis,"Which structure is involved in intermediate uveitis, and its signs?",Ciliary body pars plana; snowball/snowbank.
Ophthalmology,"Part-4 Uvea, Conjunctiva & Trachoma",Uveitis,"Which structure is involved in posterior uveitis, and its presentation?",Choroid; painless loss of vision with floaters.
Ophthalmology,"Part-4 Uvea, Conjunctiva & Trachoma",Uveitis Nodules,Where are Koeppe nodules seen (granulomatous vs non-granulomatous)?,Seen in both granulomatous and non-granulomatous uveitis.
Ophthalmology,"Part-4 Uvea, Conjunctiva & Trachoma",Uveitis Nodules,Bussaca nodules are seen in which type of uveitis?,Granulomatous only.
Ophthalmology,"Part-4 Uvea, Conjunctiva & Trachoma",Uveitis,What is a festooned pupil associated with?,Peripheral anterior synechiae.
Ophthalmology,"Part-4 Uvea, Conjunctiva & Trachoma",Fuchs Heterochromic Iridocyclitis,List the features of Fuchs heterochromic iridocyclitis (FHI).,"Heterochromia, iris atrophy, unilateral, posterior subcapsular cataract, painless with no redness."
Ophthalmology,"Part-4 Uvea, Conjunctiva & Trachoma",VKH Syndrome,"VKH syndrome is what type of uveitis, and its fundus/skin signs?",Granulomatous panuveitis; sunset-glow fundus and perilimbal vitiligo.
Ophthalmology,"Part-4 Uvea, Conjunctiva & Trachoma",Keratic Precipitates,"Mutton-fat KPs indicate which type of uveitis, and its causes?","Granulomatous; TB, sarcoidosis, leprosy, syphilis."
Ophthalmology,"Part-4 Uvea, Conjunctiva & Trachoma",Keratic Precipitates,"Fine granular KPs indicate which type, and its causes?","Non-granulomatous (lymphocytic); ankylosing spondylitis, reactive arthritis, Reiter's disease, Behcet's."
Ophthalmology,"Part-4 Uvea, Conjunctiva & Trachoma",Keratic Precipitates,Pigmented KPs are associated with which condition?,Juvenile idiopathic arthritis (JIA).
Ophthalmology,"Part-4 Uvea, Conjunctiva & Trachoma",Keratic Precipitates,Stellate KPs are associated with which conditions?,"HSV, toxoplasma, Fuchs heterochromic iridocyclitis."
Ophthalmology,"Part-4 Uvea, Conjunctiva & Trachoma",Uveitis Signs,What is Amsler's sign in uveitis?,Bleeding into the anterior chamber upon paracentesis.
Ophthalmology,"Part-4 Uvea, Conjunctiva & Trachoma",Uveitis Signs,What is Suiguira's sign?,Perilimbal vitiligo.
Ophthalmology,"Part-4 Uvea, Conjunctiva & Trachoma",Pterygium,What refractive problem does pterygium cause?,Astigmatism.
Ophthalmology,"Part-4 Uvea, Conjunctiva & Trachoma",Pterygium,How is recurrence of pterygium reduced?,Mitomycin C and conjunctival autograft.
Ophthalmology,"Part-4 Uvea, Conjunctiva & Trachoma",Pterygium,What is PERFECT surgery for pterygium?,Pterygium Extended Resection followed by Extended Conjunctival Transplant.
Ophthalmology,"Part-4 Uvea, Conjunctiva & Trachoma",Limbal Stem Cells,"Which markers identify limbal stem cells, and what does their deficiency cause?",ABCG2 and CD34; deficiency causes pterygium.
Ophthalmology,"Part-4 Uvea, Conjunctiva & Trachoma",Conjunctiva,Where is a dermoid typically located (vs pingecula)?,At the limbus.
Ophthalmology,"Part-4 Uvea, Conjunctiva & Trachoma",Follicle vs Papilla,What colour are follicles vs papillae?,Follicles: grey; papillae: pink.
Ophthalmology,"Part-4 Uvea, Conjunctiva & Trachoma",Conjunctivitis,Which agents/conditions cause a follicular reaction?,"Toxins (e.g., apraclonidine), viruses, COVID-19, Chlamydia trachomatis."
Ophthalmology,"Part-4 Uvea, Conjunctiva & Trachoma",Chlamydia,What do Chlamydia serotypes A-C cause?,Trachoma.
Ophthalmology,"Part-4 Uvea, Conjunctiva & Trachoma",Chlamydia,What do Chlamydia serotypes D-K cause?,Adult inclusion conjunctivitis (swimming-pool conjunctivitis).
Ophthalmology,"Part-4 Uvea, Conjunctiva & Trachoma",Conjunctivitis,Which conditions cause a papillary reaction?,"Bacterial, allergic (AKC, VKC), foreign body, and giant papillary conjunctivitis (contact lens users)."
Ophthalmology,"Part-4 Uvea, Conjunctiva & Trachoma",Vernal Keratoconjunctivitis,Who is typically affected by VKC (spring catarrh)?,Boys aged 5-14 years.
Ophthalmology,"Part-4 Uvea, Conjunctiva & Trachoma",Vernal Keratoconjunctivitis,List the features of VKC.,"Ropy discharge, cobblestone papillae, Horner-Tranta dots, pseudogerontoxon, Maxwell-Lyon sign, shield ulcer."
Ophthalmology,"Part-4 Uvea, Conjunctiva & Trachoma",Vernal Keratoconjunctivitis,What is the drug of choice for VKC?,Olopatadine + steroids.
Ophthalmology,"Part-4 Uvea, Conjunctiva & Trachoma",Hemorrhagic Conjunctivitis,Which viruses cause hemorrhagic conjunctivitis?,"Adenovirus, Coxsackie A24, enterovirus 70."
Ophthalmology,"Part-4 Uvea, Conjunctiva & Trachoma",Angular Conjunctivitis,Which organism causes angular conjunctivitis?,Moraxella.
Ophthalmology,"Part-4 Uvea, Conjunctiva & Trachoma",Neonatal Conjunctivitis,Chemical neonatal conjunctivitis - onset and treatment?,Onset <24 hr; eye lubricant (caused by AgNO3).
Ophthalmology,"Part-4 Uvea, Conjunctiva & Trachoma",Neonatal Conjunctivitis,Gonococcal neonatal conjunctivitis - onset and treatment?,Onset 2-5 days; ceftriaxone or cefotaxime.
Ophthalmology,"Part-4 Uvea, Conjunctiva & Trachoma",Neonatal Conjunctivitis,Chlamydial neonatal conjunctivitis - onset and treatment?,Onset 5-14 days; oral erythromycin.
Ophthalmology,"Part-4 Uvea, Conjunctiva & Trachoma",Trachoma,Trachoma is what category of disease (water classification)?,A water-washed disease.
Ophthalmology,"Part-4 Uvea, Conjunctiva & Trachoma",Trachoma,When was trachoma eliminated from India?,October 2024.
Ophthalmology,"Part-4 Uvea, Conjunctiva & Trachoma",Trachoma,What are the stages of the WHO FISTO grading of trachoma?,"TF (follicular inflammation), TI (intense inflammation), TS (scarring), TT (trichiasis), CO (corneal opacity)."
Ophthalmology,"Part-4 Uvea, Conjunctiva & Trachoma",Trachoma,Which trachoma stage shows a 'sago-grain' appearance?,Trachomatous inflammation - follicular (TF).
Ophthalmology,"Part-4 Uvea, Conjunctiva & Trachoma",Trachoma,What does the SAFE strategy stand for?,"Surgery, Antibiotics, Facial cleanliness, Environmental change."
Ophthalmology,Part-5 Glaucoma,Glaucoma,What is the classic triad/features of glaucoma?,"Raised IOP, fundus (optic disc) cupping, and visual field defects."
Ophthalmology,Part-5 Glaucoma,Angle Closure Glaucoma,What is the anterior chamber depth in angle closure glaucoma?,Shallow.
Ophthalmology,Part-5 Glaucoma,Angle Closure Glaucoma,What are the components of Vogt's triad in ACG?,"Glaucomflecken (anterior subcapsular opacity), iris atrophy, and pigment dispersion on the endothelium."
Ophthalmology,Part-5 Glaucoma,Angle Closure Glaucoma,What is glaucomflecken?,Anterior subcapsular lens opacity.
Ophthalmology,Part-5 Glaucoma,Angle Closure Glaucoma,Classic presentation of acute ACG?,Sudden painful loss of vision with a mid-dilated fixed pupil.
Ophthalmology,Part-5 Glaucoma,Angle Closure Glaucoma,What is the medical management of ACG (mnemonic AMP)?,"Acetazolamide, Mannitol, Pilocarpine."
Ophthalmology,Part-5 Glaucoma,Angle Closure Glaucoma,What is the surgical treatment of ACG?,Peripheral iridotomy.
Ophthalmology,Part-5 Glaucoma,Angle Closure Glaucoma,What are the mechanisms of angle closure?,"Pupil block, iris bombe, peripheral anterior synechiae."
Ophthalmology,Part-5 Glaucoma,Open Angle Glaucoma,Clinical presentation of POAG?,Gradual painless loss of vision.
Ophthalmology,Part-5 Glaucoma,Open Angle Glaucoma,Risk factors for POAG?,"High myopia, age over 40 years, positive family history."
Ophthalmology,Part-5 Glaucoma,Open Angle Glaucoma,What laser procedure is used in POAG?,Bilateral laser trabeculoplasty.
Ophthalmology,Part-5 Glaucoma,Malignant Glaucoma,"What is the mechanism of malignant glaucoma, and how does it resolve?",Surgery leads to ciliary block; resolves on giving atropine.
Ophthalmology,Part-5 Glaucoma,IOP,What is the normal range of intraocular pressure?,10-21 mmHg.
Ophthalmology,Part-5 Glaucoma,Tonometry,"How does a non-contact tonometer work, and what is its advanced version?",Uses a puff of air; the Ocular Response Analyzer is the advanced version.
Ophthalmology,Part-5 Glaucoma,Tonometry,What is the gold standard tonometer?,Goldmann applanation tonometer.
Ophthalmology,Part-5 Glaucoma,Tonometry,On what principle does the Goldmann applanation tonometer work?,Imbert-Fick law (P = F/A) - force is variable and area is fixed.
Ophthalmology,Part-5 Glaucoma,Tonometry,Which contact tonometer is referred to as Pascal's tonometer?,Pascal's (contact) tonometer.
Ophthalmology,Part-5 Glaucoma,Tonometry,Name the tonometers used to measure IOP (per notes).,"Schiotz, Goldmann applanation, non-contact (air puff), Pascal's (contact), and self/digital/rebound tonometers."
Ophthalmology,Part-5 Glaucoma,Gonioscopy,What does a gonioscope measure?,The anterior chamber angle.
Ophthalmology,Part-5 Glaucoma,Glaucoma Instruments,What does the Humphrey analyzer assess?,The visual field.
Ophthalmology,Part-5 Glaucoma,Gonioscopy,What type of gonioscopy do the Richardson/Koeppe lenses provide?,Direct gonioscopy.
Ophthalmology,Part-5 Glaucoma,Glaucomatous Cupping,What cup-to-disc ratio indicates abnormal glaucomatous cupping?,C:D ratio greater than 0.3.
Ophthalmology,Part-5 Glaucoma,Glaucomatous Cupping,Name signs of glaucomatous optic disc cupping.,"Nasal shift of vessels, bayonetting (abrupt turn of vessels), laminar dot sign."
Ophthalmology,Part-5 Glaucoma,Glaucomatous Cupping,"As the glaucomatous cup expands, which fibres go first and in which direction?",Arcuate fibres are lost first; the cup expands vertically.
Ophthalmology,Part-5 Glaucoma,Glaucoma Field Defects,What is the earliest visual field change in glaucoma?,Isopter contracture.
Ophthalmology,Part-5 Glaucoma,Glaucoma Field Defects,What is considered the earliest glaucomatous damage scotoma?,Bjerrum/arcuate scotoma.
Ophthalmology,Part-5 Glaucoma,Glaucoma Field Defects,List the sequence of glaucomatous visual field defects.,Isopter contracture (earliest) -> paracentral scotoma -> Seidel's scotoma -> Bjerrum/arcuate scotoma -> ring/double arcuate -> Roenne's nasal step -> loss of central vision -> temporal crescent loss (last).
Ophthalmology,Part-5 Glaucoma,Glaucoma Field Defects,Which field is lost last in glaucoma?,Temporal crescent.
Ophthalmology,Part-5 Glaucoma,Gonioscope Structures,What is the mnemonic 'I Can See Till' for gonioscope angle structures?,"Iris, Ciliary body, Scleral spur, Trabecular meshwork."
Ophthalmology,Part-5 Glaucoma,Gonioscope Structures,What does Schwalbe's line correspond to?,The cornea at the level of Descemet's membrane.
Ophthalmology,Part-5 Glaucoma,Anti-Glaucoma Drugs,List the ocular beta-blockers used in glaucoma.,"Timolol, betaxolol (selective), levobunolol, carteolol."
Ophthalmology,Part-5 Glaucoma,Anti-Glaucoma Drugs,Which ocular beta-blocker is cardioselective?,Betaxolol.
Ophthalmology,Part-5 Glaucoma,Anti-Glaucoma Drugs,What is a side effect of ocular beta-blockers?,Corneal anaesthesia.
Ophthalmology,Part-5 Glaucoma,Anti-Glaucoma Drugs,"Which nonselective alpha agonist is used, and a side effect?",Dipivefrine; causes black conjunctiva.
Ophthalmology,Part-5 Glaucoma,Anti-Glaucoma Drugs,Name the alpha-2 agonists used in glaucoma.,Apraclonidine and brimonidine.
Ophthalmology,Part-5 Glaucoma,Anti-Glaucoma Drugs,What is a side effect of apraclonidine?,Lid retraction/spasm.
Ophthalmology,Part-5 Glaucoma,Anti-Glaucoma Drugs,Why is brimonidine not used in children?,It can cause apnea and decreased GCS.
Ophthalmology,Part-5 Glaucoma,Anti-Glaucoma Drugs,Name the carbonic anhydrase inhibitors used in glaucoma.,"Acetazolamide, brinzolamide, dorzolamide."
Ophthalmology,Part-5 Glaucoma,Anti-Glaucoma Drugs,What are side effects of carbonic anhydrase inhibitors?,Sulfa allergy and metabolic acidosis.
Ophthalmology,Part-5 Glaucoma,Anti-Glaucoma Drugs,"How do beta-blockers, alpha agonists and CAIs lower IOP?",They decrease aqueous production.
Ophthalmology,Part-5 Glaucoma,Anti-Glaucoma Drugs,"How does pilocarpine lower IOP, and what are its side effects?",Increases trabecular outflow (cholinomimetic); side effects: miosis and NLD stenosis.
Ophthalmology,Part-5 Glaucoma,Anti-Glaucoma Drugs,"Which rho-kinase inhibitor is used, and its characteristic side effect?",Netarsudil; causes vortex keratopathy (cornea verticillata).
Ophthalmology,Part-5 Glaucoma,Anti-Glaucoma Drugs,List causes of vortex keratopathy / cornea verticillata.,"Fabry's disease, chloroquine, amiodarone, tamoxifen, indomethacin."
Ophthalmology,Part-5 Glaucoma,Anti-Glaucoma Drugs,Which drugs increase uveoscleral outflow and are the drug of choice?,PGF2-alpha analogues - latanoprost and bimatoprost.
Ophthalmology,Part-5 Glaucoma,Anti-Glaucoma Drugs,List side effects of prostaglandin analogues.,"Heterochromia irides, eyelash hypertrichosis, CME, reactivation of uveitis."
Ophthalmology,Part-6 Lens & Cataract,Cataract Morphology,"What causes a snowflake cataract, and by what mechanism?",Diabetics - sorbitol accumulation.
Ophthalmology,Part-6 Lens & Cataract,Cataract Morphology,What causes a sunflower cataract?,Copper deposition - Wilson's disease and chalcosis.
Ophthalmology,Part-6 Lens & Cataract,Cataract Morphology,What causes a Christmas tree cataract?,Myotonic dystrophy (CTG repeat).
Ophthalmology,Part-6 Lens & Cataract,Cataract Morphology,A cuneiform cataract corresponds to which type of cataract?,Mature cortical cataract.
Ophthalmology,Part-6 Lens & Cataract,Cataract Morphology,"What is the most common congenital cataract, and an association?",Blue dot cataract; associated with Down syndrome.
Ophthalmology,Part-6 Lens & Cataract,Cataract Morphology,"Which congenital cataract most commonly causes diminution of vision, and its associations?",Lamellar/zonular cataract; associated with rubella and vitamin D deficiency.
Ophthalmology,Part-6 Lens & Cataract,Cataract Morphology,What is the hoarfrost sign associated with?,Pseudoexfoliation syndrome.
Ophthalmology,Part-6 Lens & Cataract,Pigmentary Glaucoma,What is the Krukenberg spindle associated with?,Pigmentary glaucoma.
Ophthalmology,Part-6 Lens & Cataract,Cataract Morphology,A polychromatic / breadcrumb cataract indicates which type?,Complicated cataract.
Ophthalmology,Part-6 Lens & Cataract,Cataract Morphology,What causes a glassblower's cataract?,Radiation exposure.
Ophthalmology,Part-6 Lens & Cataract,Cataract Morphology,A shield-like cataract is associated with what?,Atopic dermatitis.
Ophthalmology,Part-6 Lens & Cataract,Lens-Induced Glaucoma,What characterizes phacomorphic glaucoma?,Intumescent cataract causing a shallow anterior chamber.
Ophthalmology,Part-6 Lens & Cataract,Lens-Induced Glaucoma,What characterizes phacolytic glaucoma?,Deep anterior chamber with leaked denatured lens proteins.
Ophthalmology,Part-6 Lens & Cataract,Lens-Induced Glaucoma,What characterizes phacotoxic glaucoma and phacoanaphylactic uveitis?,Lens particles with a capsule that is NOT intact.
Ophthalmology,Part-6 Lens & Cataract,Lens Anatomy,What lines the anterior lens capsule?,A single layer of cuboidal epithelium (A cells).
Ophthalmology,Part-6 Lens & Cataract,Lens Anatomy,Where is the area of active mitosis in the lens?,The equator (E cells - columnar cells that divide and elongate into new lens fibres).
Ophthalmology,Part-6 Lens & Cataract,Lens Anatomy,Why is there no posterior lens epithelium?,The cells are used up filling the central cavity of the lens vesicle.
Ophthalmology,Part-6 Lens & Cataract,Lens Anatomy,Where is the lens capsule thinnest?,At the equator.
Ophthalmology,Part-6 Lens & Cataract,Lens,What is the refractive index of the lens nucleus vs cortex?,Nucleus 1.41; cortex 1.38.
Ophthalmology,Part-6 Lens & Cataract,Lens,What are the water-soluble lens proteins called?,Crystallins.
Ophthalmology,Part-6 Lens & Cataract,Lens,"Which crystallin is the most common, and which is the largest?",Most common: beta; largest: alpha (provides lens transparency).
Ophthalmology,Part-6 Lens & Cataract,Lens,Are HM1 and HM2 crystallins water soluble or insoluble?,Water soluble.
Ophthalmology,Part-6 Lens & Cataract,Nuclear Cataract,"What happens to refractive index in nuclear cataract, and what phenomenon results?","RI increases further, causing index myopia and the 'second sight' phenomenon."
Ophthalmology,Part-6 Lens & Cataract,Cataract Surgery,What is the indication for ICCE?,Significant lens subluxation associated with cataract.
Ophthalmology,Part-6 Lens & Cataract,Cataract Surgery,Incision details for conventional ECCE?,7-8 mm at the limbus.
Ophthalmology,Part-6 Lens & Cataract,Cataract Surgery,Incision details for SICS?,5-6 mm sclero-corneal tunnel.
Ophthalmology,Part-6 Lens & Cataract,Cataract Surgery,"Incision details for phacoemulsification, and its mechanism?",3-3.5 mm clear corneal incision; 40 kHz piezoelectric photodisruption of lens particles.
Ophthalmology,Part-6 Lens & Cataract,Cataract Surgery,Incision size for MICS?,1-1.8 mm.
Ophthalmology,Part-6 Lens & Cataract,Cataract Surgery,What does FLACS use?,Femto laser cataract surgery using an Nd:Glass laser at 1054 nm.
Ophthalmology,Part-6 Lens & Cataract,Cataract Surgery,List the intra-operative complications of cataract surgery.,"Posterior capsular rupture +/- vitreous loss, UGH, expulsive choroidal hemorrhage, anterior capsule tear."
Ophthalmology,Part-6 Lens & Cataract,Cataract Surgery,What does UGH syndrome stand for?,"Uveitis, Glaucoma, Hyphema."
Ophthalmology,Part-6 Lens & Cataract,Cataract Surgery,What is the Argentina flag sign associated with?,An anterior capsule tear during capsulorhexis.
