subject,deck,topic,front,back
Orthopaedics,Part-3: Shoulder Dislocations & Upper Limb Fractures,Proximal Humerus Fracture,"Which proximal humerus/shaft fracture puts the radial nerve at risk, and how is it initially managed?",The Holstein-Lewis fracture (distal third of the humeral shaft); initially managed with a hanging cast or U-slab.
Orthopaedics,Part-3: Shoulder Dislocations & Upper Limb Fractures,Shoulder Dislocation - General,"Which type of shoulder dislocation is most common, and which nerve is most commonly injured?",Anterior dislocation is most common overall; the axillary nerve is the nerve most commonly injured.
Orthopaedics,Part-3: Shoulder Dislocations & Upper Limb Fractures,Shoulder Dislocation - General,What is the limb attitude and most common site in anterior shoulder dislocation?,Attitude is ABER (abduction plus external rotation); the most common site is subcoracoid.
Orthopaedics,Part-3: Shoulder Dislocations & Upper Limb Fractures,Shoulder Dislocation - General,"What are the three clinical tests for anterior shoulder dislocation, and what does each check?","Hamilton's ruler test (a ruler touches both the acromion and lateral epicondyle simultaneously), Dugas' test (difficulty touching the opposite shoulder), and Callaway's test (increased girth of the shoulder)."
Orthopaedics,Part-3: Shoulder Dislocations & Upper Limb Fractures,Shoulder Dislocation - General,What is the Modified Kocher's method (mnemonic TEAM) for reducing anterior shoulder dislocation?,"Traction, then External rotation, then Adduction, then Medial (internal) rotation."
Orthopaedics,Part-3: Shoulder Dislocations & Upper Limb Fractures,Shoulder Dislocation - General,What are the causes and limb attitude of posterior shoulder dislocation?,Causes include seizure and electrocution; the limb attitude is ADIR (adduction plus internal rotation).
Orthopaedics,Part-3: Shoulder Dislocations & Upper Limb Fractures,Shoulder Dislocation - General,"What causes inferior shoulder dislocation, and what is its eponym?","Caused by hyperabduction; called luxatio erecta, with the arm held fixed above the head."
Orthopaedics,Part-3: Shoulder Dislocations & Upper Limb Fractures,Shoulder Dislocation - General,What is a Bankart lesion?,"Avulsion of the anteroinferior glenoid labrum, associated with recurrent anterior shoulder dislocation."
Orthopaedics,Part-3: Shoulder Dislocations & Upper Limb Fractures,Shoulder Dislocation - General,What is a Hill-Sachs lesion?,A postero-lateral humeral head indentation fracture from impaction against the glenoid rim during recurrent anterior dislocation.
Orthopaedics,Part-3: Shoulder Dislocations & Upper Limb Fractures,Distal Arm Injuries - SCH,What is the most common mechanism causing a supracondylar humerus (SCH) fracture in children?,FOOSH (fall on an outstretched hand).
Orthopaedics,Part-3: Shoulder Dislocations & Upper Limb Fractures,Distal Arm Injuries - SCH,"What classification is used for supracondylar humerus fractures, and what does the extension type show?",The Gartland classification; the extension type shows posterior displacement of the distal fragment.
Orthopaedics,Part-3: Shoulder Dislocations & Upper Limb Fractures,Distal Arm Injuries - SCH,"What angle is measured on X-ray in SCH fracture, and what does '3-point maintained' mean?","Baumann's angle; '3-point maintained' means the medial epicondyle, lateral epicondyle, and olecranon still form a normal triangular relationship, indicating no rotational displacement."
Orthopaedics,Part-3: Shoulder Dislocations & Upper Limb Fractures,Distal Arm Injuries - SCH,"Which vessel is at risk in SCH fracture, and how is a pulseless/pale limb managed?","The brachial artery; managed with closed reduction and pinning, followed by open exploration and repair if the pulse remains absent afterward."
Orthopaedics,Part-3: Shoulder Dislocations & Upper Limb Fractures,Distal Arm Injuries - SCH,What traction technique has classically been used in SCH fracture management?,Dunlop-Smith traction.
Orthopaedics,Part-3: Shoulder Dislocations & Upper Limb Fractures,Lateral Condyle & Pulled Elbow,What classification system is used for lateral condylar humerus fractures?,The Milch classification.
Orthopaedics,Part-3: Shoulder Dislocations & Upper Limb Fractures,Lateral Condyle & Pulled Elbow,What age group gets 'pulled elbow' and what is the underlying pathology?,Children under about 5 years; caused by the unossified radial head slipping through/subluxating from the annular ligament.
Orthopaedics,Part-3: Shoulder Dislocations & Upper Limb Fractures,Lateral Condyle & Pulled Elbow,How is pulled elbow treated?,By flexing the elbow with supination (some describe a hyperpronation technique as an alternative).
Orthopaedics,Part-3: Shoulder Dislocations & Upper Limb Fractures,Terrible Triad of Elbow,What three injuries make up the 'terrible triad of the elbow'?,"Elbow dislocation, radial head fracture, and coronoid process fracture."
Orthopaedics,Part-3: Shoulder Dislocations & Upper Limb Fractures,Forearm Fractures,What is a 'nightstick' fracture and in what setting is it classically seen?,"An isolated ulna shaft fracture from a direct blow; classically described as a defensive injury, including in elderly abuse victims struck with a stick."
Orthopaedics,Part-3: Shoulder Dislocations & Upper Limb Fractures,Forearm Fractures,"What is a greenstick fracture, and in whom is it seen?","An incomplete, unicortical fracture, seen in children."
Orthopaedics,Part-3: Shoulder Dislocations & Upper Limb Fractures,Forearm Fractures,"What is a torus (buckle) fracture, and in whom is it seen?","An incomplete compression fracture of the cortex, seen in children."
Orthopaedics,Part-3: Shoulder Dislocations & Upper Limb Fractures,Forearm Fractures,"What is a Monteggia fracture-dislocation, and what classification system is used?",Fracture of the proximal ulna with dislocation of the radial head; classified using the BADO classification.
Orthopaedics,Part-3: Shoulder Dislocations & Upper Limb Fractures,Forearm Fractures,"What is a Galeazzi fracture-dislocation, and what radiographic sign is associated with it?",Fracture of the distal radius with dislocation of the distal radioulnar joint (DRUJ); associated with the 'piano key' sign.
Orthopaedics,Part-3: Shoulder Dislocations & Upper Limb Fractures,Forearm Fractures,What is an Essex-Lopresti injury?,A radial head fracture combined with disruption of the interosseous membrane and dislocation of the distal radioulnar joint.
Orthopaedics,Part-3: Shoulder Dislocations & Upper Limb Fractures,Forearm Fractures,What is a Maisonneuve fracture?,A proximal fibula fracture associated with disruption of the distal tibiofibular syndesmosis and/or a medial malleolus fracture or deltoid ligament injury.
Orthopaedics,Part-3: Shoulder Dislocations & Upper Limb Fractures,Forearm Fractures,What is the 'Piedmont' fracture?,"A fracture of the distal radial shaft, associated with radioulnar joint injury."
Orthopaedics,Part-4: Wrist/Hand Fractures & Abnormal Hands and Fingers,Distal Radius Fractures,"What is the mechanism, displacement direction, and deformity of a Colles' fracture?",FOOSH (fall on outstretched hand) in extension; the distal fragment displaces dorsally; produces a 'dinner-fork' deformity. It is associated with osteoporosis.
Orthopaedics,Part-4: Wrist/Hand Fractures & Abnormal Hands and Fingers,Distal Radius Fractures,"What is the mechanism, displacement direction, and deformity of a Smith's fracture?",FOOSH in flexion; the distal fragment displaces volarly (palmar); produces a 'garden-spade' deformity.
Orthopaedics,Part-4: Wrist/Hand Fractures & Abnormal Hands and Fingers,Distal Radius Fractures,What is a Barton's fracture?,An intra-articular fracture of the distal radius with associated radiocarpal joint dislocation.
Orthopaedics,Part-4: Wrist/Hand Fractures & Abnormal Hands and Fingers,Distal Radius Fractures,What is a Chauffeur's (Hutchinson) fracture?,"A fracture of the radial styloid, classically caused by avulsion from the brachioradialis tendon."
Orthopaedics,Part-4: Wrist/Hand Fractures & Abnormal Hands and Fingers,Distal Radius Fractures,What is the most common tendon rupture complication of a Colles' fracture?,Rupture of extensor pollicis longus (EPL).
Orthopaedics,Part-4: Wrist/Hand Fractures & Abnormal Hands and Fingers,Distal Radius Fractures,How is scaphoid fracture managed based on displacement?,"An undisplaced scaphoid fracture is managed with a cast (e.g., glass-holding cast in radial deviation); a displaced fracture is managed with Herbert screw fixation."
Orthopaedics,Part-4: Wrist/Hand Fractures & Abnormal Hands and Fingers,Distal Radius Fractures,What is the 'hand-shaking' cast position mnemonic (PROPA-GUNDA) used for Colles' fracture reduction?,"Pronation, then Palmar flexion, then Ulnar deviation."
Orthopaedics,Part-4: Wrist/Hand Fractures & Abnormal Hands and Fingers,Naming Confusions,Hutchinson's name is attached to three unrelated eponyms in medicine - what are they?,"1) Hutchinson (Chauffeur's) fracture - a radial styloid fracture. 2) Hutchinson's triad of congenital syphilis - Hutchinson's teeth, interstitial keratitis, and 8th cranial nerve (sensorineural) deafness. 3) Hutchinson's sign in ophthalmology - a vesicle on the tip of the nose in herpes zoster ophthalmicus, signaling nasociliary nerve involvement and risk to the eye."
Orthopaedics,Part-4: Wrist/Hand Fractures & Abnormal Hands and Fingers,Carpal Injuries,"Which carpal bone is most commonly fractured, and which is most commonly dislocated?",Scaphoid is the most commonly fractured carpal bone; the lunate is the most commonly dislocated carpal bone.
Orthopaedics,Part-4: Wrist/Hand Fractures & Abnormal Hands and Fingers,Carpal Injuries,What does the Terry-Thomas sign (also called the spilled tea-cup sign) indicate?,Scapholunate dissociation/instability.
Orthopaedics,Part-4: Wrist/Hand Fractures & Abnormal Hands and Fingers,Carpal Injuries,How do lunate and perilunate dislocations differ radiographically?,"In lunate dislocation, the lunate itself tilts out of alignment with the radius (the 'spilled tea-cup' appearance). In perilunate dislocation, the lunate stays aligned with the radius while the capitate and other carpal bones displace around it."
Orthopaedics,Part-4: Wrist/Hand Fractures & Abnormal Hands and Fingers,Hand Fractures,What is a Bennett's fracture?,A 2-part intra-articular fracture at the base of the 1st metacarpal.
Orthopaedics,Part-4: Wrist/Hand Fractures & Abnormal Hands and Fingers,Hand Fractures,What is a Rolando's fracture?,"A comminuted (3-part), intra-articular fracture at the base of the 1st metacarpal - a more severe version of Bennett's fracture."
Orthopaedics,Part-4: Wrist/Hand Fractures & Abnormal Hands and Fingers,Hand Fractures,What is a Boxer's fracture?,"A fracture of the neck of the 5th metacarpal, typically from punching."
Orthopaedics,Part-4: Wrist/Hand Fractures & Abnormal Hands and Fingers,Nerve Entrapments of Hand,What is Bowler's thumb?,"Compression neuropathy of the ulnar digital nerve of the thumb, from repetitive gripping (e.g., a bowling ball)."
Orthopaedics,Part-4: Wrist/Hand Fractures & Abnormal Hands and Fingers,Nerve Entrapments of Hand,What is Morton's neuroma?,"Fibrosis of a common digital nerve (classically the 3rd web space), causing forefoot pain; a palpable/audible click on compression is Mulder's sign."
Orthopaedics,Part-4: Wrist/Hand Fractures & Abnormal Hands and Fingers,Hand Deformities,What is diabetic cheiroarthropathy and what clinical signs does it show?,Limited joint mobility of the hands in diabetes; shown by the 'prayer sign' (inability to fully appose the palms) and the 'table-top sign' (inability to flatten the hand on a table).
Orthopaedics,Part-4: Wrist/Hand Fractures & Abnormal Hands and Fingers,Hand Deformities,What is swan neck deformity?,DIP joint flexion with PIP joint hyperextension (and often MCP flexion).
Orthopaedics,Part-4: Wrist/Hand Fractures & Abnormal Hands and Fingers,Hand Deformities,"In osteoarthritis of the hand, what are Heberden's and Bouchard's nodules (mnemonic DH-PB)?",Heberden's nodules occur at the DIP joints; Bouchard's nodules occur at the PIP joints.
Orthopaedics,Part-4: Wrist/Hand Fractures & Abnormal Hands and Fingers,Hand Infections,What is Kanavel's sign and what condition does it indicate?,"Signs of suppurative flexor tenosynovitis: finger held in slight flexion, fusiform swelling, tenderness along the flexor tendon sheath, and pain on passive extension. The most common causative organism is Staphylococcus aureus."
Orthopaedics,Part-4: Wrist/Hand Fractures & Abnormal Hands and Fingers,Hand Infections,"What is a felon, and what is its most common causative organism?",An infection of the finger pulp space; most commonly caused by Staphylococcus aureus.
Orthopaedics,Part-4: Wrist/Hand Fractures & Abnormal Hands and Fingers,Hand Infections,What is paronychia?,An infection involving the nail fold/nail bed.
Orthopaedics,Part-4: Wrist/Hand Fractures & Abnormal Hands and Fingers,Tendon Injuries of Hand,What causes trigger finger?,"The flexor tendon becomes trapped/thickened at the A1 pulley, causing catching or locking during finger extension."
Orthopaedics,Part-4: Wrist/Hand Fractures & Abnormal Hands and Fingers,Tendon Injuries of Hand,"What is Gamekeeper's/Skier's thumb, and how is it managed?","Avulsion of the ulnar collateral ligament of the thumb MCP joint; managed with a thumb spica splint. If the adductor pollicis aponeurosis becomes interposed in the tear (Stener lesion), surgery is required."
Orthopaedics,Part-4: Wrist/Hand Fractures & Abnormal Hands and Fingers,Tendon Injuries of Hand,What is a baseball (mallet) finger?,"Rupture (or avulsion) of the extensor tendon at the DIP joint, causing a flexed distal phalanx that cannot actively extend."
Orthopaedics,Part-4: Wrist/Hand Fractures & Abnormal Hands and Fingers,Tendon Injuries of Hand,"What is a rugby (jersey) finger, and how is it managed?",Avulsion/rupture of the flexor digitorum profundus tendon from the distal phalanx; managed with a frog splint or aluminium splint.
Orthopaedics,Part-4: Wrist/Hand Fractures & Abnormal Hands and Fingers,Tendon Injuries of Hand,What is Dupuytren's contracture and its associated conditions?,Progressive fibrosis of the palmar fascia causing finger flexion contractures; associated with diabetes mellitus and cirrhosis. Related fibrosing conditions are Ledderhose disease (plantar fascia) and Peyronie's disease (penile fascia).
Orthopaedics,Part-4: Wrist/Hand Fractures & Abnormal Hands and Fingers,Casts for Upper Limb,"What is a hanging cast/U-slab used for, and how does it work?",Used for proximal humerus fractures; gravity through the hanging weight of the cast helps reduce and align the fracture.
Orthopaedics,Part-4: Wrist/Hand Fractures & Abnormal Hands and Fingers,Casts for Upper Limb,"What cast is used for a patella fracture, and what radiographic view assesses it?",A cylindrical cast is used for undisplaced patella fractures; the skyline view is used to assess the patella and identify a bipartite patella.
Orthopaedics,Part-4: Wrist/Hand Fractures & Abnormal Hands and Fingers,Casts for Upper Limb,"How are olecranon and patella fractures managed surgically, and what is the biomechanical principle?","Managed with tension band wiring (using K-wires), which converts distraction forces at the fracture site into compression forces, aiding healing."
Orthopaedics,Part-4: Wrist/Hand Fractures & Abnormal Hands and Fingers,Casts for Upper Limb,"What is the Insall-Salvati index, and what do abnormal values indicate?","The ratio of patellar tendon length to patella length; a ratio >1.2 indicates patella alta (high-riding patella, a cause of recurrent patellar dislocation), while <0.8 indicates patella baja."
Orthopaedics,"Part-5: Hip Dislocations, NOF/ITF Fractures & Femoral Shaft",Hip Dislocation,"Which type of hip dislocation is most common, and what is the classic mechanism?","Posterior dislocation is most common; the classic mechanism is a dashboard injury (axial load through a flexed knee/hip, e.g., in a road traffic accident)."
Orthopaedics,"Part-5: Hip Dislocations, NOF/ITF Fractures & Femoral Shaft",Hip Dislocation,What are the clinical/radiographic features of posterior hip dislocation?,"Shortening of the limb, a smaller-appearing femoral head on X-ray, the lesser trochanter not easily seen, and risk of sciatic nerve injury."
Orthopaedics,"Part-5: Hip Dislocations, NOF/ITF Fractures & Femoral Shaft",Hip Dislocation,What are the clinical/radiographic features of anterior hip dislocation?,"Lengthening of the limb, a bigger-appearing femoral head on X-ray, the lesser trochanter easily seen, and risk of femoral nerve injury."
Orthopaedics,"Part-5: Hip Dislocations, NOF/ITF Fractures & Femoral Shaft",Hip Dislocation,"What does a positive FADIR test (flexion, adduction, internal rotation) suggest?",TB hip arthritis or posterior hip dislocation.
Orthopaedics,"Part-5: Hip Dislocations, NOF/ITF Fractures & Femoral Shaft",Hip Dislocation,"What does a positive FABER test (flexion, abduction, external rotation) suggest?","TB synovitis, septic arthritis, iliotibial band contracture, or anterior hip dislocation."
Orthopaedics,"Part-5: Hip Dislocations, NOF/ITF Fractures & Femoral Shaft",Hip/Femoral Neck Fractures,What clinical features suggest a more severe or unstable hip fracture?,"More age, more trauma, more pain, more shortening, and external rotation greater than 45 degrees."
Orthopaedics,"Part-5: Hip Dislocations, NOF/ITF Fractures & Femoral Shaft",Hip/Femoral Neck Fractures,"What classification is used for intertrochanteric fractures, and what deformity results from malunion?",Evan's classification; malunion classically results in coxa vara.
Orthopaedics,"Part-5: Hip Dislocations, NOF/ITF Fractures & Femoral Shaft",Hip/Femoral Neck Fractures,"How are intertrochanteric (extracapsular) fractures managed, and which is preferred?","Proximal femoral nailing (intramedullary, treatment of choice) or dynamic hip screw/DHS (extramedullary)."
Orthopaedics,"Part-5: Hip Dislocations, NOF/ITF Fractures & Femoral Shaft",Hip/Femoral Neck Fractures,How is management of a femoral neck (intracapsular) fracture decided by age and time since injury?,Age >65 years: hemiarthroplasty. Age <65 years and <3 weeks since fracture: closed reduction with internal fixation. Age <65 years and >3 weeks since fracture: augmented osteotomy.
Orthopaedics,"Part-5: Hip Dislocations, NOF/ITF Fractures & Femoral Shaft",Hip/Femoral Neck Fractures,What classification is used for femoral neck fracture displacement?,Garden's classification.
Orthopaedics,"Part-5: Hip Dislocations, NOF/ITF Fractures & Femoral Shaft",Hip/Femoral Neck Fractures,"What does the Pauwels classification assess, and what does a higher grade mean?","It classifies femoral neck fractures by the angle of the fracture line; a higher grade (steeper angle, Pauwels III) means greater shear force and higher risk of nonunion."
Orthopaedics,"Part-5: Hip Dislocations, NOF/ITF Fractures & Femoral Shaft",Hip/Femoral Neck Fractures,What is the Pipkin classification used for?,Femoral head fractures that occur in association with hip dislocation.
Orthopaedics,"Part-5: Hip Dislocations, NOF/ITF Fractures & Femoral Shaft",Hip/Femoral Neck Fractures,Name the three hemiarthroplasty prosthesis types used in femoral neck fracture.,"Thompson prosthesis, Austin-Moore prosthesis (unipolar), and Bipolar prosthesis."
Orthopaedics,"Part-5: Hip Dislocations, NOF/ITF Fractures & Femoral Shaft",Hip/Femoral Neck Fractures,When is total hip replacement preferred over hemiarthroplasty for a femoral neck fracture?,When there is pre-existing hip osteoarthritis or avascular necrosis affecting the joint.
Orthopaedics,"Part-5: Hip Dislocations, NOF/ITF Fractures & Femoral Shaft",Femoral Shaft Fracture Management,What is the age-based management protocol for pediatric femoral shaft fractures?,0-6 months: Pavlik harness. 6 months-5 years: spica casting. 5-10 years: flexible intramedullary nail or TENS. Over 10 years: locked intramedullary nail.
Orthopaedics,"Part-5: Hip Dislocations, NOF/ITF Fractures & Femoral Shaft",Femoral Shaft Fracture Management,What traction devices correspond to each pediatric age group for femoral shaft fracture?,"Pavlik harness (0-6 months), Gallow's traction (<2 years), Bryant's traction (<2 years), Hip spica (2-10 years), and Perkin's skin traction (>10 years)."
Orthopaedics,"Part-5: Hip Dislocations, NOF/ITF Fractures & Femoral Shaft",Femoral Shaft Fracture Management,What is Russell's skin traction used for?,Intertrochanteric fractures.
Orthopaedics,Part-6: Knee/Ankle/Foot Fractures & Sports Injuries,ACL/PCL Tests,"At what knee flexion angles are Lachman's test and the anterior drawer test performed, and which is preferred for ACL?",Lachman's test is performed at 20-30 degrees of flexion and is preferred (more sensitive); the anterior drawer test is performed at 90 degrees of flexion.
Orthopaedics,Part-6: Knee/Ankle/Foot Fractures & Sports Injuries,ACL/PCL Tests,What are the two functional bundles of the ACL and when is each taut?,The anteromedial (A/M) bundle is taut in flexion; the posterolateral (P/L) bundle is taut in extension.
Orthopaedics,Part-6: Knee/Ankle/Foot Fractures & Sports Injuries,ACL/PCL Tests,What structures prevent anterior versus posterior tibial translation at the knee?,The ACL prevents anterior translation; the PCL prevents posterior translation.
Orthopaedics,Part-6: Knee/Ankle/Foot Fractures & Sports Injuries,ACL/PCL Tests,What tests assess PCL integrity?,The posterior drawer test and the sag sign.
Orthopaedics,Part-6: Knee/Ankle/Foot Fractures & Sports Injuries,ACL/PCL Tests,What does the pivot shift test assess?,"Anterolateral rotatory instability, indicating ACL injury."
Orthopaedics,Part-6: Knee/Ankle/Foot Fractures & Sports Injuries,ACL/PCL Tests,What does the dial test assess?,Posterolateral corner injury (often with associated PCL injury).
Orthopaedics,Part-6: Knee/Ankle/Foot Fractures & Sports Injuries,Collateral Ligament Tests,"Which stress test assesses the MCL, and which assesses the LCL?",Valgus stress test assesses the MCL; varus stress test assesses the LCL.
Orthopaedics,Part-6: Knee/Ankle/Foot Fractures & Sports Injuries,Collateral Ligament Tests,Do isolated collateral ligament injuries typically cause knee hemarthrosis?,"No - collateral ligaments are extra-articular, so their injury does not cause hemarthrosis, unlike cruciate or meniscal injuries."
Orthopaedics,Part-6: Knee/Ankle/Foot Fractures & Sports Injuries,Collateral Ligament Tests,"What is O'Donoghue's 'unhappy triad,' and what mechanism causes it?","A combined injury of the MCL, ACL, and medial meniscus, classically from a valgus force combined with rotation."
Orthopaedics,Part-6: Knee/Ankle/Foot Fractures & Sports Injuries,Meniscal Tests,"Which clinical tests assess meniscal injury, and which has the highest diagnostic accuracy?","McMurray's test, Apley's grinding test (compression plus rotation, tests menisci) and Apley's distraction test (tests ligaments instead); Thessaly's test has high diagnostic accuracy."
Orthopaedics,Part-6: Knee/Ankle/Foot Fractures & Sports Injuries,Meniscal Tests,What is the investigation of choice and the gold standard test for suspected knee ligament or meniscal injury?,MRI is the investigation of choice; arthroscopy is the gold standard.
Orthopaedics,Part-6: Knee/Ankle/Foot Fractures & Sports Injuries,Meniscal Tests,"How are meniscal tears classified by zone, and how does management differ?",Outer 'red-red' zone tears are vascularized and can be repaired; inner 'white-white' zone tears are avascular (no blood supply) and are managed by resection.
Orthopaedics,Part-6: Knee/Ankle/Foot Fractures & Sports Injuries,Knee Fractures & Soft Tissue,What is a Segond fracture and what ligament injury is it associated with?,"An avulsion fracture of the lateral tibial condyle by the lateral capsular ligament; associated with ACL injury in about 80% of cases, so MRI should follow."
Orthopaedics,Part-6: Knee/Ankle/Foot Fractures & Sports Injuries,Knee Fractures & Soft Tissue,What classification system is used for tibial plateau (bumper) fractures?,The Schatzker classification.
Orthopaedics,Part-6: Knee/Ankle/Foot Fractures & Sports Injuries,Knee Fractures & Soft Tissue,What is a Pellegrini-Stieda lesion?,Calcification/ossification at the femoral origin of the MCL following an MCL avulsion injury.
Orthopaedics,Part-6: Knee/Ankle/Foot Fractures & Sports Injuries,Knee Fractures & Soft Tissue,What is Osgood-Schlatter disease?,"Traction osteochondritis at the tibial tuberosity (patellar tendon insertion), seen in adolescents."
Orthopaedics,Part-6: Knee/Ankle/Foot Fractures & Sports Injuries,Knee Fractures & Soft Tissue,"How are patella fractures managed based on displacement, and what view is used to assess them?",Displaced patella fractures are managed with tension band wiring; undisplaced fractures are managed with a cylindrical cast. The skyline view assesses patella fractures and bipartite patella.
Orthopaedics,Part-6: Knee/Ankle/Foot Fractures & Sports Injuries,Ankle/Foot Fractures,What is a pilon fracture?,"An intra-articular, often comminuted fracture of the distal tibia (plafond)."
Orthopaedics,Part-6: Knee/Ankle/Foot Fractures & Sports Injuries,Ankle/Foot Fractures,What classification system is used for talus fractures (aviator fracture)?,The Hawkins classification.
Orthopaedics,Part-6: Knee/Ankle/Foot Fractures & Sports Injuries,Ankle/Foot Fractures,"What is a calcaneal fracture also known as, and which angles are assessed radiographically?",Also called a lover's fracture (classically from a fall from height); assessed using Bohler's angle and Gissane's angle.
