subject,deck,topic,front,back
Orthopaedics,Part-6: Knee/Ankle/Foot Fractures & Sports Injuries,Ankle/Foot Fractures,What is Sever's disease?,"Calcaneal apophysitis (traction osteochondritis at the calcaneal growth plate), seen in children."
Orthopaedics,Part-6: Knee/Ankle/Foot Fractures & Sports Injuries,Ankle/Foot Fractures,What are bimalleolar and trimalleolar ankle fractures also called?,Bimalleolar fracture is called Pott's fracture; trimalleolar fracture is called Cotton's fracture.
Orthopaedics,Part-6: Knee/Ankle/Foot Fractures & Sports Injuries,Ankle/Foot Fractures,"What classification is used for ankle fractures, and what are the Ottawa ankle rules used for?",The Danis-Weber classification is used for ankle fractures; the Ottawa ankle rules help decide whether an X-ray is needed in suspected ankle fracture.
Orthopaedics,Part-6: Knee/Ankle/Foot Fractures & Sports Injuries,Ankle/Foot Fractures,What is a jumper's fracture and where does it occur?,"A fracture of the sacrum caused by an axial load, such as landing from a jump."
Orthopaedics,Part-6: Knee/Ankle/Foot Fractures & Sports Injuries,Ankle/Foot Fractures,"Which classification systems are used for sacral, acetabular, and pelvic ring fractures?","Denis classification for the sacrum, Judet and Letournel classification for the acetabulum, and Young and Burgess classification for the pelvic ring (lateral compression, AP compression, and vertical shear patterns)."
Orthopaedics,Part-6: Knee/Ankle/Foot Fractures & Sports Injuries,Ankle/Foot Fractures,What is a Chopart fracture-dislocation?,An intertarsal (midtarsal) fracture-dislocation.
Orthopaedics,Part-6: Knee/Ankle/Foot Fractures & Sports Injuries,Ankle/Foot Fractures,What is a Lisfranc fracture-dislocation?,A tarsometatarsal joint fracture-dislocation.
Orthopaedics,Part-6: Knee/Ankle/Foot Fractures & Sports Injuries,Ankle/Foot Fractures,What is a true Jones fracture?,"A fracture at the metaphyseal-diaphyseal junction (zone 2) of the base of the 5th metatarsal, a watershed area with poor blood supply and high nonunion risk."
Orthopaedics,Part-6: Knee/Ankle/Foot Fractures & Sports Injuries,Ankle/Foot Fractures,What is a pseudo-Jones (dancer's) fracture?,An avulsion fracture of the base of the 5th metatarsal by the peroneus brevis tendon (zone 1 - tuberosity avulsion).
Orthopaedics,Part-6: Knee/Ankle/Foot Fractures & Sports Injuries,Ankle/Foot Fractures,Which metatarsal is most commonly affected by stress (March) fractures?,The 2nd metatarsal.
Orthopaedics,Part-6: Knee/Ankle/Foot Fractures & Sports Injuries,Ankle/Foot Fractures,What is Kohler's disease?,"Osteochondrosis (avascular necrosis) of the navicular bone, seen in children."
Orthopaedics,"Part-7: Spine - Fractures, Spondylolisthesis, AS & Scoliosis",Spine Trauma,"What does SCIWORA stand for, in whom is it most common, and what is the investigation of choice?",Spinal Cord Injury WithOut Radiographic Abnormality; most common in children; the investigation of choice is MRI.
Orthopaedics,"Part-7: Spine - Fractures, Spondylolisthesis, AS & Scoliosis",Spine Trauma,"What is a Jefferson (burst) fracture, which vertebra is involved, and is it stable?",A burst fracture of the atlas (C1); it is a stable fracture.
Orthopaedics,"Part-7: Spine - Fractures, Spondylolisthesis, AS & Scoliosis",Spine Trauma,What is a Clay Shoveler's fracture?,An avulsion fracture of the C7 spinous process.
Orthopaedics,"Part-7: Spine - Fractures, Spondylolisthesis, AS & Scoliosis",Spine Trauma,What is a Hangman's fracture and what is its mechanism?,"A fracture through the pars interarticularis of C2 (with spondylolisthesis of C2 on C3), caused by axial loading combined with hyperextension."
Orthopaedics,"Part-7: Spine - Fractures, Spondylolisthesis, AS & Scoliosis",Spine Trauma,What is a burst fracture of a vertebral body?,A compression fracture with retropulsion of bone fragments into the spinal canal.
Orthopaedics,"Part-7: Spine - Fractures, Spondylolisthesis, AS & Scoliosis",Spine Trauma,"What is a Chance fracture, and is it stable?",A flexion-distraction injury involving all three spinal columns (Denis 3-column injury); it is unstable.
Orthopaedics,"Part-7: Spine - Fractures, Spondylolisthesis, AS & Scoliosis",Spine Trauma,What is a 'carrot stick' fracture and in what condition does it occur?,"A transverse fracture through a rigid, ossified spine, seen in patients with ankylosing spondylitis."
Orthopaedics,"Part-7: Spine - Fractures, Spondylolisthesis, AS & Scoliosis",Spine Trauma,How many people are needed for a log-roll maneuver (minimum and ideal)?,Minimum of 4 people; ideally 5 people.
Orthopaedics,"Part-7: Spine - Fractures, Spondylolisthesis, AS & Scoliosis",Spondylolysis & Listhesis,What is spondylolysis?,A fracture/defect of the pars interarticularis.
Orthopaedics,"Part-7: Spine - Fractures, Spondylolisthesis, AS & Scoliosis",Spondylolysis & Listhesis,What is spondylolisthesis?,Forward slippage of one vertebra over the vertebra below it.
Orthopaedics,"Part-7: Spine - Fractures, Spondylolisthesis, AS & Scoliosis",Spondylolysis & Listhesis,"On an oblique lumbar X-ray, what does the 'Scotty dog' sign show, and what do a 'collar' and a 'beheaded' Scotty dog indicate?","The Scotty dog represents the posterior elements of a lumbar vertebra on oblique view; a 'collar' on the dog's neck indicates spondylolysis (pars defect), and a 'beheaded' (decapitated) Scotty dog indicates spondylolisthesis."
Orthopaedics,"Part-7: Spine - Fractures, Spondylolisthesis, AS & Scoliosis",Spondylolysis & Listhesis,"In an L4-L5 disc prolapse, which nerve root exits at that level, which is traversing, and which is more commonly compressed?",L4 is the exiting nerve root; L5 is the traversing root - the traversing root (L5) is more commonly compressed by a posterolateral disc herniation.
Orthopaedics,"Part-7: Spine - Fractures, Spondylolisthesis, AS & Scoliosis",Ankylosing Spondylitis,What is the typical clinical profile of ankylosing spondylitis?,"A young male with inflammatory back ache, positive HLA-B27, uveitis, and bilateral heel pain (enthesitis)."
Orthopaedics,"Part-7: Spine - Fractures, Spondylolisthesis, AS & Scoliosis",Ankylosing Spondylitis,"What is the first radiographic site of involvement in ankylosing spondylitis, and the best imaging investigation?",Sacroiliitis is the first site involved; MRI-STIR sequence is the most sensitive investigation.
Orthopaedics,"Part-7: Spine - Fractures, Spondylolisthesis, AS & Scoliosis",Ankylosing Spondylitis,"What are syndesmophytes, and what radiographic patterns do they create in ankylosing spondylitis?",Bony bridges between vertebrae causing a 'bamboo spine' appearance; also described as a 'tram-track sign' or 'dagger sign' on X-ray.
Orthopaedics,"Part-7: Spine - Fractures, Spondylolisthesis, AS & Scoliosis",Ankylosing Spondylitis,What clinical test measures spinal flexion in suspected ankylosing spondylitis?,The Modified Schober's test.
Orthopaedics,"Part-7: Spine - Fractures, Spondylolisthesis, AS & Scoliosis",Ankylosing Spondylitis,How is ankylosing spondylitis treated?,"NSAIDs, and biologics (e.g., anti-TNF agents) for refractory disease."
Orthopaedics,"Part-7: Spine - Fractures, Spondylolisthesis, AS & Scoliosis",Ankylosing Spondylitis,"What is DISH (diffuse idiopathic skeletal hyperostosis), and what is its classic radiographic description?",A condition of ligamentous ossification (especially the anterior longitudinal ligament) seen in elderly patients (Forestier's disease); described as a 'flowing wax candle' appearance.
Orthopaedics,"Part-7: Spine - Fractures, Spondylolisthesis, AS & Scoliosis",Ankylosing Spondylitis,What is ochronosis and how does it affect the spine?,A manifestation of alkaptonuria causing intervertebral disc calcification.
Orthopaedics,"Part-7: Spine - Fractures, Spondylolisthesis, AS & Scoliosis",Ankylosing Spondylitis,"What condition should be considered as a differential when spinal cord compression occurs with posterior longitudinal ligament ossification, and where is it classically described?","OPLL (ossification of the posterior longitudinal ligament), classically described as 'Japan's disease.'"
Orthopaedics,"Part-7: Spine - Fractures, Spondylolisthesis, AS & Scoliosis",Scoliosis,How is scoliosis defined and measured?,"A lateral spinal curvature greater than 10 degrees, measured using Cobb's angle."
Orthopaedics,"Part-7: Spine - Fractures, Spondylolisthesis, AS & Scoliosis",Scoliosis,How does the Adams forward bending test differentiate postural from structural scoliosis?,"If the curve corrects/resolves on forward bending, it is postural scoliosis; if the curve persists on bending, it is structural scoliosis."
Orthopaedics,"Part-7: Spine - Fractures, Spondylolisthesis, AS & Scoliosis",Scoliosis,What is the management threshold for scoliosis based on curve angle?,Curves less than 40 degrees are managed with bracing; curves greater than 40-50 degrees require surgery.
Orthopaedics,"Part-7: Spine - Fractures, Spondylolisthesis, AS & Scoliosis",Scoliosis,What index is used to assess skeletal maturity in scoliosis management?,Risser's index.
Orthopaedics,"Part-7: Spine - Fractures, Spondylolisthesis, AS & Scoliosis",Scoliosis,Name the bracing/casting options used in scoliosis and which is considered most effective.,"Minerva cast, Milwaukee brace, Boston brace, and Charleston brace; the Charleston brace is considered the most effective."
Orthopaedics,"Part-8: Bone Infections (Osteomyelitis, Pott's Spine, TB Hip)",Pott's Spine (TB Spine),What is the most common pattern of vertebral involvement in Pott's spine?,Paradiscal involvement.
Orthopaedics,"Part-8: Bone Infections (Osteomyelitis, Pott's Spine, TB Hip)",Pott's Spine (TB Spine),What is the investigation of choice for Pott's spine?,Contrast-enhanced MRI.
Orthopaedics,"Part-8: Bone Infections (Osteomyelitis, Pott's Spine, TB Hip)",Pott's Spine (TB Spine),What is the standard medical treatment and bracing for Pott's spine?,"Anti-tubercular therapy (ATT) for 12-18 months, along with a Taylor's brace."
Orthopaedics,"Part-8: Bone Infections (Osteomyelitis, Pott's Spine, TB Hip)",Pott's Spine (TB Spine),What findings indicate the need for surgery/biopsy in Pott's spine?,"No improvement on treatment, suspected drug resistance, suspicion of an alternate diagnosis, new weakness or sensory loss, and bladder/bowel involvement; surgery is done via an antero-lateral approach for decompression."
Orthopaedics,"Part-8: Bone Infections (Osteomyelitis, Pott's Spine, TB Hip)",Pott's Spine (TB Spine),"What type of ankylosis is typical of TB spine, versus TB affecting a joint like the knee or hip?","TB spine typically causes bony ankylosis; TB of a joint (knee, hip) typically causes fibrous ankylosis."
Orthopaedics,"Part-8: Bone Infections (Osteomyelitis, Pott's Spine, TB Hip)",TB Hip,What is Phemister's triad and what does it indicate?,"Periarticular osteopenia, erosions, and reduced joint space; indicates TB arthritis (such as TB hip)."
Orthopaedics,"Part-8: Bone Infections (Osteomyelitis, Pott's Spine, TB Hip)",TB Hip,"What classic radiographic appearance is described in TB hip, and where is it most commonly seen?","A 'mortar and pestle' appearance, most commonly involving the acetabulum."
Orthopaedics,"Part-8: Bone Infections (Osteomyelitis, Pott's Spine, TB Hip)",Chronic Osteomyelitis,What is a sequestrum in chronic osteomyelitis?,"A piece of dead, densely sclerotic (white) bone that has separated from viable bone."
Orthopaedics,"Part-8: Bone Infections (Osteomyelitis, Pott's Spine, TB Hip)",Chronic Osteomyelitis,What is an involucrum in chronic osteomyelitis?,"A layer of new, lucent (black) bone with granulation tissue that forms around a sequestrum."
Orthopaedics,"Part-8: Bone Infections (Osteomyelitis, Pott's Spine, TB Hip)",Chronic Osteomyelitis,What is a cloaca in chronic osteomyelitis?,An opening/sinus tract through the involucrum through which pus or sequestrum can discharge.
Orthopaedics,"Part-8: Bone Infections (Osteomyelitis, Pott's Spine, TB Hip)",Chronic Osteomyelitis,What is the intraoperative 'paprika sign' and what does it indicate?,"Punctate bleeding points seen on bone during surgery, indicating viable, well-vascularized bone with a good prognosis for healing."
Orthopaedics,"Part-8: Bone Infections (Osteomyelitis, Pott's Spine, TB Hip)",Chronic Osteomyelitis,What is Brodie's abscess?,"A localized form of subacute osteomyelitis, typically with a history of subacute inflammation."
Orthopaedics,"Part-8: Bone Infections (Osteomyelitis, Pott's Spine, TB Hip)",Radiographic Triangles & Misc,"What is the Babcock triangle associated with, and what is its most common site?",TB hip; most commonly involves the acetabulum.
Orthopaedics,"Part-8: Bone Infections (Osteomyelitis, Pott's Spine, TB Hip)",Radiographic Triangles & Misc,What is the Fairbank triangle associated with?,Congenital coxa vara.
Orthopaedics,"Part-8: Bone Infections (Osteomyelitis, Pott's Spine, TB Hip)",Radiographic Triangles & Misc,What is the Ward triangle associated with?,Osteoporosis (an area of relative trabecular weakness in the femoral neck).
Orthopaedics,"Part-8: Bone Infections (Osteomyelitis, Pott's Spine, TB Hip)",Radiographic Triangles & Misc,"Where is a Baker's cyst located, and what condition can its rupture mimic?",Located between the semimembranosus and medial gastrocnemius tendons in the popliteal fossa; rupture can mimic deep vein thrombosis (DVT).
Orthopaedics,Part-9: Bone Tumors,Bone Tumor Epidemiology,"What is the most common bone tumor overall, and the most common primary bone tumor?",Metastasis is the most common bone tumor overall (lytic metastases are far more common than blastic); multiple myeloma is the most common primary bone tumor.
Orthopaedics,Part-9: Bone Tumors,Bone Tumor Epidemiology,"What is the most common benign bone tumor, and the most common TRUE benign bone tumor?",Osteochondroma is the most common benign bone tumor; osteoid osteoma is the most common true benign bone tumor.
Orthopaedics,Part-9: Bone Tumors,Bone Tumor Epidemiology,"Which bone tumor is most sensitive to chemo/radiotherapy, and which is most resistant?",Ewing's sarcoma is most sensitive; osteosarcoma is most resistant.
Orthopaedics,Part-9: Bone Tumors,Bone Tumor Epidemiology,What is the most common radiation-induced bone tumor?,Osteosarcoma.
Orthopaedics,Part-9: Bone Tumors,Bone Tumor Epidemiology,"What is the most common source of bone metastasis, and which tumor most commonly spreads bone-to-bone?",Lung cancer is the most common source of bone metastasis; Ewing's sarcoma and osteosarcoma most commonly metastasize bone-to-bone.
Orthopaedics,Part-9: Bone Tumors,Bone Tumor Epidemiology,Which bone tumors are most common in the 0-20 year age group?,"Ewing's sarcoma, osteosarcoma, and simple/aneurysmal bone cysts (SBC/ABC)."
Orthopaedics,Part-9: Bone Tumors,Bone Tumor Epidemiology,Which bone tumor is most common in the 20-40 year age group?,Giant cell tumor (GCT).
Orthopaedics,Part-9: Bone Tumors,Bone Tumor Epidemiology,Which bone tumors are most common after age 40?,"Metastasis, multiple myeloma, chondrosarcoma, and Paget's/radiation-associated osteosarcoma."
Orthopaedics,Part-9: Bone Tumors,Molecular Markers,"What immunohistochemical markers are associated with Ewing's sarcoma, and what genetic translocation?",CD99 and mic2 markers; t(11;22) translocation. Histologically it is a small round blue cell tumor.
Orthopaedics,Part-9: Bone Tumors,Molecular Markers,Which genes/proteins are associated with osteosarcoma?,"p53, RB, INK4, CDK4, MDM2, and chromothripsis."
Orthopaedics,Part-9: Bone Tumors,Molecular Markers,Which histone mutation is associated with giant cell tumor (GCT) of bone?,H3-G34W.
Orthopaedics,Part-9: Bone Tumors,Molecular Markers,"What targeted drug is used in GCT, and what does it target?","Denosumab, which targets RANKL."
Orthopaedics,Part-9: Bone Tumors,Molecular Markers,What genetic rearrangement is associated with aneurysmal bone cyst (ABC)?,USP6 rearrangement (ABC shares some features with GCT).
Orthopaedics,Part-9: Bone Tumors,Molecular Markers,Which genes are associated with osteochondroma/hereditary multiple exostoses?,EXT1 and EXT2.
Orthopaedics,Part-9: Bone Tumors,Molecular Markers,"What immunohistochemical marker is used for chordoma, and where does chordoma classically arise?",Brachyury; chordoma classically arises at the sacrum or the clivus.
Orthopaedics,Part-9: Bone Tumors,Molecular Markers,Which bone lesions classically show fluid-fluid levels on MRI (mnemonic G-MAT)?,"Giant cell tumor (GCT), Metastases (vascular, e.g. RCC or follicular thyroid carcinoma), Aneurysmal bone cyst (ABC), and Telangiectatic osteosarcoma."
Orthopaedics,Part-9: Bone Tumors,Aggressive vs Non-Aggressive Imaging,What five radiographic features distinguish aggressive from non-aggressive bone lesions?,"Type of bone destruction, zone of transition/margins, cortical integrity, periosteal reaction, and soft tissue involvement."
Orthopaedics,Part-9: Bone Tumors,Aggressive vs Non-Aggressive Imaging,"What are the three bone destruction patterns from least to most aggressive, and which periosteal reaction is classically aggressive?",Geographic (benign) < moth-eaten (aggressive) < permeative (most aggressive); an 'onion peel' periosteal reaction is classic for aggressive lesions such as Ewing's sarcoma and osteosarcoma.
Orthopaedics,Part-9: Bone Tumors,Epiphyseal Tumors,"What tumor presents in children with chicken-wire calcification, and what is its eponym?","Chondroblastoma, also called Codman's tumor."
Orthopaedics,Part-9: Bone Tumors,Epiphyseal Tumors,"What is the classic age, imaging appearance, and cell type of giant cell tumor (GCT)/osteoclastoma?","Occurs at 30-40 years of age; shows a 'soap bubble' appearance; the neoplastic cells are mononuclear stromal cells, with benign multinucleated giant cells present."
Orthopaedics,Part-9: Bone Tumors,Metaphyseal Tumors,"What is a simple (unicameral) bone cyst, and what sign indicates a pathologic fracture through it?","A benign, fluid-filled cyst seen in children that predisposes to pathologic fracture; a fallen fragment produces the 'fallen leaf' or 'trap door' sign."
Orthopaedics,Part-9: Bone Tumors,Metaphyseal Tumors,"What is the most common malignant bone tumor, and what predisposing factors/genes are linked to it?","Osteosarcoma; predisposed by RB gene mutation, p53 mutation, Paget's disease, and prior radiotherapy."
Orthopaedics,Part-9: Bone Tumors,Metaphyseal Tumors,"What is myositis ossificans, its cause, and the most commonly affected muscle?","Heterotopic ossification within muscle (metaplasia of muscle into bone), often triggered by massage/manipulation after a supracondylar humerus fracture; the brachialis muscle is most commonly affected."
Orthopaedics,Part-9: Bone Tumors,Diaphyseal Tumors,"What is osteoid osteoma, what is the investigation of choice, and how is it treated?",A cortical-based benign tumor causing nocturnal pain relieved by NSAIDs; investigation of choice is non-contrast CT (NCCT); treated with radiofrequency ablation (RFA) of the nidus.
Orthopaedics,Part-9: Bone Tumors,Diaphyseal Tumors,"What clinical picture can Ewing's sarcoma mimic, and what is its classic histology?","It can mimic infection with fever, redness, and raised ESR; histologically it is a small round blue cell tumor."
Orthopaedics,Part-9: Bone Tumors,Diaphyseal Tumors,In which bone does adamantinoma classically arise?,The tibia.
Orthopaedics,Part-9: Bone Tumors,Miscellaneous Tumors,What is Ollier's disease and what is Maffucci's syndrome?,Ollier's disease is multiple enchondromatosis; Maffucci's syndrome is multiple enchondromatosis combined with hemangiomas.
Orthopaedics,Part-9: Bone Tumors,Miscellaneous Tumors,"What suggests malignant transformation of an osteochondroma, and how is it managed?",A cartilage cap thicker than 1.5 cm suggests transformation to chondrosarcoma (investigation of choice is MRI); it is treated with extraperiosteal resection.
Orthopaedics,Part-9: Bone Tumors,Miscellaneous Tumors,What are the classic imaging/histologic features of fibrous dysplasia?,A 'Shepherd's crook' deformity of the proximal femur and a 'Chinese letter' pattern on histology.
Orthopaedics,Part-9: Bone Tumors,Miscellaneous Tumors,What is McCune-Albright syndrome?,Polyostotic fibrous dysplasia with precocious puberty and cafe-au-lait macules described as having a 'coast of Maine' (irregular) border.
Orthopaedics,Part-9: Bone Tumors,Miscellaneous Tumors,What is Mazabraud syndrome?,Fibrous dysplasia associated with intramuscular myxomas.
Orthopaedics,Part-9: Bone Tumors,Miscellaneous Tumors,What are the classic features of chondrosarcoma?,"Occurs in elderly patients, classically at the pelvis or scapula, showing 'ring and arc' calcification on imaging."
Orthopaedics,Part-9: Bone Tumors,Miscellaneous Tumors,Which bone is most commonly affected by osteoblastoma?,The vertebra.
Orthopaedics,Part-9: Bone Tumors,Miscellaneous Tumors,"What is the most common benign tumor of the spine, and what imaging patterns does it show?",Hemangioma; shows a 'polka dot' pattern on axial imaging and a 'jailbar/corduroy cloth' pattern on sagittal/coronal imaging.
Orthopaedics,Part-9: Bone Tumors,Management of Bone Tumors,How are osteosarcoma and chondrosarcoma primarily managed?,"Surgery, with or without neoadjuvant chemotherapy."
Orthopaedics,Part-9: Bone Tumors,Management of Bone Tumors,How is Ewing's sarcoma primarily managed?,Chemotherapy combined with radiotherapy.
Orthopaedics,Part-9: Bone Tumors,Management of Bone Tumors,Which lesions are managed with extended curettage (mnemonic CAGE-FD)?,"Chondroblastoma, Aneurysmal bone cyst, Giant cell tumor, Enchondroma, and Fibrous Dysplasia."
Orthopaedics,Part-9: Bone Tumors,Management of Bone Tumors,"How is a simple bone cyst (SBC) managed, and how are osteochondroma and osteoid osteoma managed?",Simple bone cyst is managed with simple curettage; osteochondroma is managed with resection; osteoid osteoma is managed with radiofrequency ablation (RFA).
Orthopaedics,Part-10: Metabolic Bone Disease & Skull X-Ray Patterns,Hyperparathyroidism & Related,"What causes primary hyperparathyroidism, and what happens to serum calcium and phosphate?",Caused by a parathyroid adenoma; serum calcium rises and phosphate falls due to increased PTH.
Orthopaedics,Part-10: Metabolic Bone Disease & Skull X-Ray Patterns,Hyperparathyroidism & Related,What is the classic cause of secondary hyperparathyroidism?,"Chronic kidney disease (CKD), leading to compensatory PTH elevation."
Orthopaedics,Part-10: Metabolic Bone Disease & Skull X-Ray Patterns,Hyperparathyroidism & Related,What causes hypercalcemia of malignancy?,"Most classically, squamous cell carcinoma secreting PTHrP (parathyroid hormone-related peptide)."
Orthopaedics,Part-10: Metabolic Bone Disease & Skull X-Ray Patterns,Hyperparathyroidism & Related,Why does sarcoidosis cause hypercalcemia?,"Granulomas produce excess 1-alpha-hydroxylase, which increases activation of vitamin D."
Orthopaedics,Part-10: Metabolic Bone Disease & Skull X-Ray Patterns,Hyperparathyroidism & Related,"What is Albright hereditary osteodystrophy, and which condition is it associated with?","A phenotype of short 4th and 5th metacarpals with short stature and round facies, caused by a GNAS gene mutation; associated with pseudohypoparathyroidism (end-organ resistance to PTH)."
Orthopaedics,Part-10: Metabolic Bone Disease & Skull X-Ray Patterns,Hyperparathyroidism & Related,How does pseudohypoparathyroidism differ from pseudo-pseudohypoparathyroidism?,"Pseudohypoparathyroidism shows the Albright phenotype WITH true biochemical end-organ PTH resistance; pseudo-pseudohypoparathyroidism shows the same physical phenotype but with normal PTH, calcium, and phosphate levels."
Orthopaedics,Part-10: Metabolic Bone Disease & Skull X-Ray Patterns,Hyperparathyroidism & Related,"Which bone conditions typically show normal calcium, phosphate, and PTH levels, and which shows a raised ALP?","Paget's disease and osteoporosis typically show normal calcium, phosphate, and PTH; Paget's disease characteristically shows an elevated ALP (a marker of bone formation)."
Orthopaedics,Part-10: Metabolic Bone Disease & Skull X-Ray Patterns,Hyperparathyroidism & Related,What is a classic hand radiographic sign of Turner syndrome?,"A short 4th metacarpal (compare to Albright hereditary osteodystrophy, which shows short 4th AND 5th metacarpals)."
Orthopaedics,Part-10: Metabolic Bone Disease & Skull X-Ray Patterns,Hyperparathyroidism & Related,What are the classic radiographic features of hyperparathyroidism?,"Subperiosteal bone resorption (hallmark finding, best seen at the radial aspect of the phalanges), 'salt and pepper' skull, 'rugger jersey' spine, loss of lamina dura around the teeth, and brown tumors (osteitis fibrosa cystica)."
Orthopaedics,Part-10: Metabolic Bone Disease & Skull X-Ray Patterns,Paget's Disease,What are the three phases of Paget's disease of bone?,"Lytic phase, then a mixed phase, then a blastic (sclerotic) phase."
Orthopaedics,Part-10: Metabolic Bone Disease & Skull X-Ray Patterns,Paget's Disease,What population is classically affected by Paget's disease?,Elderly patients.
Orthopaedics,Part-10: Metabolic Bone Disease & Skull X-Ray Patterns,Paget's Disease,What are classic radiographic features of Paget's disease?,"Ivory vertebra, picture-frame vertebra, osteoporosis circumscripta (an early lytic skull lesion), Tam o' Shanter/cotton wool skull appearance, ilio-pectineal line thickening (one of the earliest signs), and a 'mosaic' bone pattern on histology."
Orthopaedics,Part-10: Metabolic Bone Disease & Skull X-Ray Patterns,Paget's Disease,What are the complications of Paget's disease?,"Pathological fracture, secondary osteosarcoma, and high-output cardiac failure (from increased vascularity of pagetoid bone)."
